"sn","id","Associated Disease","Disease Ontology Description","UniProt Description","Protein Count","Direct Association Count","Mondo ID","GARD Rare","Symbol","UniProt","Disease Data Source","JensenLab TextMining zscore","JensenLab Confidence","Expression Atlas Log2 Fold Change","DisGeNET Score","Associated Disease Evidence","Associated Disease Drug Name","Associated Disease P-value","Associated Disease Source","Associated Disease Source ID","Monarch S2O", "diseases_name", "symptoms_1", "symptoms_2", "symptoms_3", "symptoms_4", "symptoms_5", "symptoms_6", "symptoms_7", "symptoms_8", "symptoms_9", "description", "symptoms_description", "causes_description", "causes_1", "causes_2", "causes_3", "causes_4", "causes_5", "treatment_1", "treatment_2", "treatment_3", "prevention_1", "prevention_2", "prevention_3", "risk_factor", "age_of_onset", "genetic_factors", "family_history", "severity_of_disease", "diagnosis_methods", "complications", "epidemiology", "prognosis""0","1","11-Beta-hydroxylase deficiency","NAN","Cytochrome P450 11B1 isoform 1 (CYP11B1) is an enzyme that catalyzes the final step in the synthesis of cortisol and aldosterone. It is involved in steroid hormone biosynthesis.","1","1","MONDO:0005067","False","CYP11B1","P15538","DisGeNET","0.5","0.8","0.2","0.4","Genetic variants","Hydrocortisone","5.0E-05","CTD_human","UMLS:C3669121","NAN","Congenital adrenal hyperplasia due to 11-beta-hydroxylase deficiency","Hypertension","Virilization","Early puberty","Short stature","NAN","NAN","NAN","NAN","NAN","NAN","11-beta-hydroxylase deficiency is a rare genetic disorder that affects the adrenal glands. It is caused by a mutation in the CYP11B1 gene, which leads to a deficiency in the enzyme 11-beta-hydroxylase. This enzyme is responsible for producing cortisol and aldosterone, two hormones that are essential for regulating blood pressure, electrolyte balance, and stress response.","Symptoms include high blood pressure, virilization (development of male characteristics in females), early puberty, and short stature.","The condition is caused by mutations in the CYP11B1 gene.","Mutation in CYP11B1 gene","Inheritance","Consanguinity","NAN","NAN","Hydrocortisone replacement therapy","Salt-wasting crisis management","Spironolactone","Genetic counseling","Prenatal diagnosis (if family history)","Regular monitoring of hormone levels","Family history","Childhood","Autosomal recessive inheritance","Family history of congenital adrenal hyperplasia","Variable@ ranging from mild to severe","Hormone testing@ genetic testing","Adrenal crisis@ hypertension","1 in 100,000 to 1 in 200,000 births","Good with appropriate treatment","Good with appropriate treatment""0","1","11-Beta-hydroxylase deficiency","NAN","Cytochrome P450 11B1, involved in cortisol biosynthesis","1","1","MONDO:0005020","GARD:0007143","CYP11B1","P15538","DisGeNET","2.5","0.8","0.5","0.4","Genetic association@ SNPs linked to CYP11B1","Hydrocortisone","0.0001","CTD_human","UMLS:C3669121","Decreased cortisol@ increased androgens","Congenital Adrenal Hyperplasia Due to 11-Beta-Hydroxylase Deficiency","Hypertension@ Virilization@ Premature puberty@ Masculinization in females@ Adrenal insufficiency@ Ambiguous genitalia in females@ Salt-wasting crisis","Excessive hair growth@ Deepening voice@ Muscle enlargement","Acne@ Irregular menstrual periods@ Increased muscle mass@ Enlarged clitoris","Early puberty@ Difficulty conceiving@ Increased appetite@ Weight gain","NAN","NAN","NAN","NAN","NAN","11-beta-hydroxylase deficiency is a rare genetic disorder that affects the adrenal glands. It is caused by a mutation in the CYP11B1 gene, which leads to a deficiency in the enzyme 11-beta-hydroxylase. This enzyme is responsible for producing cortisol and aldosterone, two hormones essential for regulating blood pressure, blood sugar, and electrolyte balance.","Symptoms include hypertension@ virilization@ and premature puberty. Females may experience ambiguous genitalia at birth.","11-beta-hydroxylase deficiency is caused by mutations in the CYP11B1 gene. This gene provides instructions for making an enzyme called 11-beta-hydroxylase, which is essential for the production of cortisol and aldosterone.","Mutation in CYP11B1 gene","Autosomal recessive inheritance","Consanguinity","NAN","NAN","NAN","NAN","NAN","Hydrocortisone","Fludrocortisone","Salt supplementation","Genetic counseling","Prenatal diagnosis","Carrier screening","Family history@ Consanguinity","Newborn screening","Mutation in CYP11B1 gene","Autosomal recessive inheritance","Mild to severe@ depending on the specific mutation","Physical examination@ Hormone level testing@ Genetic testing","Adrenal crisis@ Infertility@ Psychological problems","Estimated incidence of 1 in 100@000 to 1 in 200@000 births","Generally good with proper treatment.","NAN"
"1","2","12q14 microdeletion syndrome","NAN","NAN","2","2","MONDO:0019784","1.0","HMGA2","P52926","Monarch","NAN","NAN","NAN","NAN","ECO:0000323: imported automatically asserted information used in automatic assertion","NAN","NAN","NAN","Orphanet:94063","96.181635991","12q14 microdeletion syndrome","NAN","NAN","NAN","NAN","NAN","NAN","NAN","NAN","NAN","A rare genetic disorder caused by a deletion of genetic material on chromosome 12 at position 14. The deletion affects the HMGA2 gene@ which plays a role in regulating DNA structure and gene expression.","NAN","NAN","NAN","NAN","NAN","NAN","NAN","NAN","NAN","NAN","NAN","NAN","NAN","NAN","NAN","NAN","NAN","NAN","NAN","NAN","NAN","NAN","NAN"
"2","2","12q14 microdeletion syndrome","NAN","NAN","2","2","MONDO:0019784","1.0","LEMD3","Q9Y2U8","Monarch","NAN","NAN","NAN","NAN","ECO:0000323: imported automatically asserted information used in automatic assertion","NAN","NAN","NAN","Orphanet:94063","72.5503898105","12q14 microdeletion syndrome","Developmental delay","Intellectual disability","Hypotonia","Feeding difficulties","Facial dysmorphism","Skeletal abnormalities","Heart defects","Growth retardation","Seizures","12q14 microdeletion syndrome is a rare genetic disorder characterized by a deletion of genetic material on chromosome 12 at position q14. The severity and specific symptoms can vary widely among affected individuals.","Common symptoms include developmental delay@ intellectual disability@ hypotonia (low muscle tone)@ feeding difficulties@ distinctive facial features@ skeletal abnormalities@ heart defects@ growth retardation@ and seizures. The range of symptoms reflects the diverse functions of the genes located in the deleted region.","The condition is caused by a deletion of genetic material on the long arm (q) of chromosome 12 at position 14. The size of the deletion can vary@ affecting the number of genes that are missing.","Deletion on chromosome 12q14","Spontaneous genetic mutation","NAN","NAN","NAN","Supportive care","Physical therapy","Speech therapy","Genetic counseling","Prenatal testing (if family history)","NAN","Rare genetic disorder; no specific risk factors known.","Variable; often apparent in infancy or early childhood.","The condition is genetic@ caused by a deletion of genetic material. The specific genes affected within the deleted region contribute to the observed symptoms.","May have a family history@ but the deletion is often a de novo (new) occurrence.","Variable; ranges from mild to severe depending on the size of the deletion and the genes involved.","Chromosomal microarray analysis","Heart defects@ seizures@ feeding difficulties@ and developmental delays.","Extremely rare; prevalence is unknown.","Variable; depends on the severity of symptoms and associated complications. Life expectancy can be normal with proper management."
"3","2","12q14 microdeletion syndrome","NAN","A rare genetic disorder characterized by a microdeletion on chromosome 12q14, often involving the HMGA2 gene.","2","2","MONDO:0019784","1.0","HMGA2","P52926","DisGeNET","NAN","NAN","NAN","0.3","0 SNPs","NAN","NAN","ORPHANET","UMLS:C4305140","NAN","12q14 microdeletion syndrome","Developmental delay","Intellectual disability","Growth retardation","Facial dysmorphism","Skeletal abnormalities","Heart defects","Feeding difficulties","Speech delay","Seizures","12q14 microdeletion syndrome is a rare genetic disorder resulting from a deletion of genetic material on the long arm (q) of chromosome 12@ specifically at position 12q14. This deletion often includes the HMGA2 gene.","The specific symptoms and severity can vary widely among affected individuals. Common features include developmental delay@ intellectual disability@ growth retardation@ distinctive facial features@ skeletal abnormalities@ and sometimes heart defects. Feeding difficulties and speech delay are also frequently observed.","The condition is caused by a deletion of a small piece of chromosome 12 at position q14. This deletion typically occurs randomly and is not inherited. However@ in some cases@ it can be inherited from a parent with a balanced translocation.","De novo deletion","Unbalanced translocation (rare)","Specific gene deletions within the region","NAN","NAN","Supportive care","Physical therapy","Speech therapy","Early intervention programs","Genetic counseling","Regular monitoring of development and health","NAN","Variable@ ranging from infancy to early childhood","NAN","NAN","Variable@ ranging from mild to severe","Clinical evaluation@ chromosomal microarray analysis (CMA)@ and potentially other genetic testing","Congenital heart defects@ feeding difficulties leading to failure to thrive@ seizures@ and other developmental and medical complications","Extremely rare@ precise incidence unknown","Variable@ depending on the severity of the condition and the specific complications. Lifespan may be normal@ but quality of life can be significantly impacted."
"4","2","12q14 microdeletion syndrome","NAN","LEMD3 is involved in bone growth and development@ specifically affecting endochondral ossification.","2","2","MONDO:0019784","1.0","LEMD3","Q9Y2U8","DisGeNET","NAN","NAN","NAN","0.3","'0 SNPs' indicates genetic variants associated with the disease@ potentially impacting gene expression or protein function.","NAN","NAN","ORPHANET","UMLS:C4305140","NAN","'12q14 Microdeletion Syndrome'","Developmental delay","Intellectual disability","Hypotonia","Feeding difficulties","Facial dysmorphism","Skeletal abnormalities","Cardiac defects","Seizures","Hearing loss","A rare genetic disorder caused by a deletion of genetic material on chromosome 12@ specifically in the region designated 12q14. This deletion affects multiple genes in this region@ leading to a variety of physical and developmental abnormalities.","Symptoms vary widely among affected individuals@ but commonly include developmental delay@ intellectual disability@ hypotonia (decreased muscle tone)@ feeding difficulties@ distinctive facial features@ skeletal abnormalities@ cardiac defects@ seizures@ and hearing loss. The severity and specific manifestations of the syndrome can differ greatly.","The syndrome is caused by a deletion of genetic material on chromosome 12 in the 12q14 region. The size and exact location of the deletion can vary among affected individuals.","Deletion of genes in 12q14","Genetic mutations affecting LEMD3","Unknown","NAN","NAN","NAN","Supportive therapies","Physical therapy","Occupational therapy","Genetic counseling for parents","Prenatal diagnosis may be available","Early intervention programs","NAN","Infancy or early childhood","Genetic deletion in the 12q14 region","Recurrence risk depends on the specific genetic makeup of the parents","Variable@ ranging from mild to severe","Chromosome analysis","Genetic testing","NAN","Extremely rare@ affecting a small number of individuals worldwide","Variable@ depends on the severity of the condition and the specific complications that develop"
"5","3","14q12 microdeletion syndrome","NAN","NAN","1","1","MONDO:0016833","NAN","FOXG1","P55316","Monarch","NAN","NAN","NAN","NAN","ECO:0000323: imported automatically asserted information used in automatic assertion","NAN","NAN","NAN","Orphanet:261144","76.0097646349","14q12 Microdeletion Syndrome","Developmental Delay","Intellectual Disability","Seizures","Microcephaly","Hypotonia","Feeding Difficulties","Absent or Delayed Speech","Cortical Visual Impairment","Movement Disorders","14q12 microdeletion syndrome is a rare genetic disorder caused by the deletion of a small piece of chromosome 14 at position q12. This deletion includes the FOXG1 gene@ which is crucial for brain development.","Common symptoms include developmental delay@ intellectual disability@ seizures@ microcephaly@ hypotonia@ and feeding difficulties. Other possible symptoms include absent or delayed speech@ cortical visual impairment@ and movement disorders. The severity and presentation of symptoms can vary among individuals.","14q12 microdeletion syndrome is caused by a deletion of genetic material on chromosome 14@ specifically at position q12. This deletion includes the FOXG1 gene. The deletion usually occurs spontaneously and is not inherited.","De novo deletion","Chromosomal breakage","Unidentified genetic factors","NAN","NAN","Supportive care","Physical therapy","Occupational therapy","Genetic counseling","Early intervention","Nutritional support","The exact risk factors are unknown as it is a rare genetic disorder. However@ factors that increase the chance of chromosomal abnormalities in general may theoretically increase the risk.","Symptoms are typically present from birth or early infancy.","The condition is caused by a deletion of the FOXG1 gene.","Generally not inherited@ but recurrence can occur if one of the parents has a balanced translocation that involves chromosome 14.","The severity of the disease varies from patient to patient. Some people are mildly affected while others are more severely affected.","Diagnosis is usually based on genetic testing such as chromosomal microarray analysis (CMA) to detect the deletion on chromosome 14. Further testing may include brain MRI to evaluate brain structure and EEG to assess seizure activity.","Complications can include severe intellectual disability@ feeding difficulties requiring a feeding tube@ respiratory issues@ and mobility problems.","14q12 microdeletion syndrome is a rare disorder@ with an estimated prevalence of less than 1 in 1@000@000.","The prognosis varies depending on the severity of symptoms. Early intervention and supportive care can help improve the quality of life for affected individuals."
"6","3","14q12 microdeletion syndrome","A rare genetic condition caused by the deletion of genetic material on chromosome 14@ specifically in the 14q12 region. This deletion typically includes the FOXG1 gene@ which plays a crucial role in brain development.","The FOXG1 protein is a transcription factor involved in brain development@ particularly in the formation of the cerebral cortex. It regulates the expression of other genes essential for neural cell proliferation@ differentiation@ and migration.","1","1","MONDO:0016833","NAN","FOXG1","P55316","DisGeNET","0.0","0.0","0.0","0.3","0 SNPs","NAN","0.0","ORPHANET","UMLS:C4305240","NAN","14q12 microdeletion syndrome","Intellectual disability","Developmental delay","Seizures","Microcephaly","Feeding difficulties","Movement disorders","Sleep disturbances","Visual impairment","Absent or delayed speech","NAN","Individuals with 14q12 microdeletion syndrome often experience a range of symptoms related to impaired brain development. These can include intellectual disability@ delayed motor skills@ speech difficulties@ seizures@ and behavioral problems. The severity of these symptoms can vary significantly among affected individuals.","The primary cause is a deletion of genetic material on chromosome 14 in the 14q12 region. This deletion typically encompasses the FOXG1 gene. The deletion can occur spontaneously (de novo) or be inherited from a parent with a balanced translocation.","Deletion on chromosome 14q12","De novo mutation","Inherited translocation","NAN","NAN","Physical therapy","Speech therapy","Occupational therapy","Early intervention programs","Special education","Support groups","NAN","Early childhood","Genetic mutation","NAN","Variable@ ranging from mild to severe","Genetic testing (chromosome microarray analysis or FISH)","Developmental delays@ intellectual disability@ seizures@ feeding difficulties@ behavioral problems","Rare disease@ prevalence is unknown","Variable@ depends on the severity of the condition and access to supportive care. With early intervention and comprehensive management@ individuals can achieve their full potential. "
"7","4","15q11q13 microduplication syndrome","The 15q11.2-q13.1 duplication syndrome (dup15q syndrome) is a clinically recognizable syndrome that results from the presence of one or more extra copies of the 15q11.2-q13.1 region.","The protein encoded by this gene is an E3 ubiquitin ligase that is involved in the ubiquitination and degradation of specific proteins. It plays a role in various cellular processes, including protein turnover, DNA repair, and neuronal development.","1","1","MONDO:0012081","NAN","UBE3A","Q05086","Monarch","NAN","NAN","NAN","NAN","ECO:0000322: imported manually asserted information used in automatic assertion","NAN","NAN","NAN","OMIM:608636","68.8739471257","dup15q syndrome","Developmental delay@ intellectual disability","Seizures","Hypotonia","Autism spectrum disorder","Sleep disturbances","Gastrointestinal problems","Behavioral issues","Sensory processing difficulties","Distinct facial features","Dup15q syndrome is characterized by developmental delay, intellectual disability, seizures, hypotonia, autism spectrum disorder, sleep disturbances, gastrointestinal problems, and behavioral issues. Affected individuals may also have sensory processing difficulties and distinct facial features.","The symptoms of dup15q syndrome vary in severity and can include developmental delays, intellectual disability, seizures, hypotonia, autism spectrum disorder, sleep disturbances, gastrointestinal problems, behavioral issues, sensory processing difficulties, and distinct facial features.","Dup15q syndrome is caused by the presence of one or more extra copies of the 15q11.2-q13.1 region on chromosome 15.","Duplication of the 15q11.2-q13.1 region","Maternal inheritance of the duplication","Interstitial or isodicentric duplication","NAN","NAN","There is no cure for dup15q syndrome, and treatment focuses on managing the symptoms.","Therapy includes early intervention programs","Physical therapy@ occupational therapy@ and speech therapy can help improve motor skills@ communication skills@ and adaptive skills.","Genetic counseling can help families understand the risk of recurrence.","Support groups and online communities can provide information and support to families affected by dup15q syndrome.","NAN","NAN","Early diagnosis and intervention can help improve the outcome for individuals with dup15q syndrome.","NAN","NAN","A family history of dup15q syndrome or other genetic disorders may increase the risk of having a child with dup15q syndrome.","Varies@ but often presents in early childhood","Genetic factors play a significant role in dup15q syndrome.","A family history of dup15q syndrome increases the risk.","Variable@ ranging from mild to severe","Diagnosis is based on clinical findings and confirmed by genetic testing such as chromosome microarray analysis (CMA) or fluorescence in situ hybridization (FISH).","Complications can include seizures@ developmental delays@ intellectual disability@ autism spectrum disorder@ and behavioral issues.","The prevalence of dup15q syndrome is estimated to be 1 in 30@000 live births.","The prognosis for individuals with dup15q syndrome varies depending on the severity of the symptoms and the presence of associated medical conditions. Early intervention and supportive care can help improve the outcome."
"8","4","15q11q13 microduplication syndrome","A rare genetic syndrome caused by the duplication of a small segment of chromosome 15@ specifically the region q11.2-q13. This duplication leads to an increased dosage of genes in this region@ particularly the UBE3A gene@ resulting in developmental delay@ intellectual disability@ and other characteristic features.","UBE3A is a ubiquitin ligase involved in protein degradation and synaptic function. Its overexpression in 15q11q13 microduplication syndrome contributes to the neurological symptoms.","1","1","MONDO:0012081","NAN","UBE3A","Q05086","DisGeNET","NAN","NAN","NAN","0.3","0 SNPs","NAN","NAN","ORPHANET","UMLS:C2675336","NAN","15q11.2-q13 duplication syndrome","Developmental delay","Intellectual disability","Seizures","Hypotonia","Autism spectrum disorder","Speech delay","Sleep disturbances","Feeding difficulties","Gastrointestinal problems","15q11q13 microduplication syndrome is characterized by the duplication of a specific region on chromosome 15@ leading to a constellation of developmental and neurological issues. The severity and specific symptoms can vary significantly between individuals.","The symptoms arise from the increased gene dosage in the duplicated region@ primarily affecting neurological development and function.","The primary cause is the microduplication of the 15q11.2-q13 region on chromosome 15. This duplication is often spontaneous (de novo) but can be inherited in some cases.","Microduplication of 15q11.2-q13","Spontaneous genetic mutation","Inherited genetic mutation","NAN","NAN","Early intervention therapies","Speech therapy","Occupational therapy","Genetic counseling","Family support","Regular monitoring","NAN","Early childhood","Genetic factors contribute to the syndrome due to the increased gene dosage from the duplicated region.","Family history is not typically a primary risk factor@ as most cases are de novo mutations@ but recurrence is possible.","The severity of the disease varies@ with some individuals experiencing milder symptoms than others. Factors such as the size and location of the duplication can influence the severity.","Genetic testing (chromosome microarray analysis)","Developmental and behavioral assessments","Seizures","Gastrointestinal complications","Sleep disturbances","The exact epidemiology is not well-established@ but it is considered a rare genetic disorder.","The prognosis varies depending on the severity of the symptoms and the effectiveness of interventions. Early and comprehensive support can improve developmental outcomes.
"9","5","15q14 microdeletion syndrome","A rare genetic condition caused by a missing piece of chromosome 15@ specifically in the q14 region.","Involved in transcriptional regulation and development.","1","1","MONDO:0014822","NAN","MEIS2","O14770","Monarch","0.5","0.8","1.2","0.7","ECO:0000322: Imported manually asserted information used in automatic assertion","NAN","NAN","NAN","OMIM:616898","100.0","15q14 Microdeletion Syndrome","Developmental Delay","Intellectual Disability","Facial Dysmorphism","Hypotonia","Speech Delay","Feeding Difficulties","Seizures","Cardiac Anomalies","Skeletal Abnormalities","15q14 microdeletion syndrome is a rare genetic disorder resulting from a deletion in the q14 region of chromosome 15. This deletion affects the MEIS2 gene@ which plays a crucial role in development.","Symptoms of 15q14 microdeletion syndrome vary but often include developmental delay@ intellectual disability@ distinct facial features@ hypotonia (low muscle tone)@ and speech delay. Other symptoms can include feeding difficulties@ seizures@ cardiac anomalies@ and skeletal abnormalities.","The syndrome is caused by a deletion in the 15q14 region of chromosome 15. This deletion is usually a de novo (new) mutation@ meaning it is not inherited from the parents but occurs spontaneously during the formation of reproductive cells or in early embryonic development.","Deletion in Chromosome 15","Spontaneous Mutation","Genetic Abnormality","NAN","NAN","Early Intervention Therapies","Physical Therapy","Speech Therapy","Genetic Counseling","Prenatal Testing","Early Detection","Exposure to Teratogens","NAN","Genetic Inheritance","Family history of similar conditions","Severity ranges from mild to severe@ depending on the size of the deletion and the genes affected.","Genetic Testing (Chromosomal Microarray Analysis)","Cardiac problems@ feeding difficulties@ seizures@ and developmental delays can lead to other complications if not managed properly.","The syndrome is rare@ with a low prevalence in the general population.","The prognosis varies depending on the severity of the symptoms. Early intervention and supportive care can help improve the quality of life. "
