"55","21","20p12.3 microdeletion syndrome","The disease ontology description is currently unavailable. Further research is needed to provide a comprehensive description of this condition.","The UniProt description is currently unavailable. Further investigation is required to determine the protein function and characteristics associated with this syndrome.","1","1","MONDO:0016841","1.0","BMP2","P12643","Monarch","NAN","NAN","NAN","NAN","ECO:0000322: imported manually asserted information used in automatic assertion","NAN","NAN","NAN","Orphanet:261295","60.8645066746","20p12.3 microdeletion syndrome","Delayed development","Intellectual disability","Speech delay","Feeding difficulties","Hypotonia (low muscle tone)","Behavioral problems","Distinctive facial features","Heart defects","Skeletal abnormalities","20p12.3 microdeletion syndrome is a rare genetic disorder caused by a missing piece of chromosome 20 in the 20p12.3 region. This deletion can lead to a variety of developmental and physical problems.","Symptoms of 20p12.3 microdeletion syndrome can vary greatly depending on the size and location of the deletion. Common symptoms include delayed development@ intellectual disability@ speech delay@ feeding difficulties@ hypotonia@ behavioral problems@ distinctive facial features@ heart defects@ and skeletal abnormalities.","The cause of 20p12.3 microdeletion syndrome is a deletion of genetic material on chromosome 20 at the 20p12.3 band. This deletion typically occurs randomly during the formation of reproductive cells or in early fetal development.","De novo mutation (most cases)","Inheritance (rare)","Errors during meiosis (cell division)","Exposure to teratogens during pregnancy","Genetic instability in the 20p12.3 region","Supportive care","Physical therapy","Speech therapy","Genetic counseling","Prenatal testing (for families with a history)","Avoiding exposure to teratogens during pregnancy","While there are no specific risk factors known for 20p12.3 microdeletion syndrome@ the following may be considered:","Varies@ but often present from birth or early childhood","De novo mutations in the 20p12.3 region","Family history of genetic disorders","Severity can vary greatly depending on the size and location of the deletion. Some individuals may have mild symptoms@ while others may have more severe disabilities.","Chromosomal microarray analysis","Karyotyping","Echocardiogram (for heart defects)","Scoliosis (curvature of the spine)","Recurrent infections","Feeding problems","Developmental delay","The prevalence of 20p12.3 microdeletion syndrome is estimated to be very rare.","The prognosis for individuals with 20p12.3 microdeletion syndrome varies depending on the severity of the symptoms and the availability of appropriate medical and therapeutic interventions."
"56","21","20p12.3 microdeletion syndrome","A rare genetic condition resulting from a small deletion on chromosome 20@ region p12.3. Characterized by variable developmental delays@ distinctive facial features@ and potential congenital anomalies.","Associated with haploinsufficiency of genes within the deleted region@ particularly BMP2@ which plays a critical role in skeletal development and cell signaling.","1","1","MONDO:0016841","1.0","BMP2","P12643","DisGeNET","NAN","NAN","NAN","0.3","0 SNPs","NAN","NAN","ORPHANET","UMLS:C4304539","NAN","20p12.3 Microdeletion Syndrome","Developmental Delay","Facial Dysmorphism","Intellectual Disability","Congenital Anomalies","Growth Retardation","Behavioral Problems","Feeding Difficulties","Skeletal Abnormalities","Heart Defects","A genetic disorder caused by the deletion of genetic material on chromosome 20@ specifically in the region designated as p12.3. This deletion can lead to a variety of health and developmental challenges.","Symptoms and signs vary widely based on the size of the deletion and the genes involved. Common features include developmental delays@ intellectual disability@ distinctive facial features (such as a high forehead@ broad nasal bridge@ and small chin)@ growth retardation@ and congenital anomalies (heart defects@ skeletal abnormalities). Feeding difficulties and behavioral problems may also be present.","The primary cause is a de novo (new) deletion on chromosome 20@ region p12.3. These deletions are typically random events during the formation of egg or sperm cells or during early embryonic development. While most cases are not inherited@ recurrent deletions have been linked to specific chromosomal structures that predispose individuals to this condition.","De novo deletion on chromosome 20p12.3","Spontaneous genetic mutation","Errors during meiosis (formation of egg or sperm cells)","Chromosomal instability","NAN","Supportive therapy","Physical therapy","Occupational therapy","Genetic counseling","Prenatal testing (if deletion is known in a parent)","Regular medical checkups","Deletion size","Variable; may depend on specific genes deleted","Typically not inherited@ but genetic counseling recommended","No clear link to family history@ generally de novo","Variable; ranges from mild to severe developmental delays and physical abnormalities","Chromosomal microarray analysis (CMA)","Echocardiogram (to assess for heart defects)","Skeletal X-rays (to evaluate bone abnormalities)","Growth failure","Developmental delays","Feeding difficulties","Increased risk of infections","Exact incidence is unknown due to rarity of the condition. Reported cases are limited@ making epidemiological data scarce.","Variable depending on severity and associated anomalies. Lifespan may be impacted by the presence of significant congenital heart defects or other severe medical complications."
"57","22","22q11 Deletion Syndrome","Genetic disorder caused by a deletion on the long arm of chromosome 22.","Fibroblast growth factor 8, a signaling protein involved in development.","10","10","MONDO:0002008","Yes","FGF8","P55075","CTD","4.2","0.9","0.5","0.7","Marker/Mechanism","", "0.0005","CTD","MESH:D058165","","22q11.2 deletion syndrome","Heart defects","Palatal abnormalities","Immune deficiency","Learning difficulties","Developmental delay","Facial dysmorphia","Feeding difficulties","Hearing loss","Kidney problems","A genetic disorder caused by a small missing piece of chromosome 22@ specifically at position 22q11.2. This deletion can affect multiple body systems.","Symptoms vary widely but can include heart defects@ cleft palate@ distinctive facial features@ learning difficulties@ and immune system problems.","The deletion of genetic material from chromosome 22 at position q11.2 is the cause. Usually the deletion occurs randomly during the formation of reproductive cells (eggs or sperm) or early in fetal development.","Deletion on chromosome 22","Genetic mutation","Inherited or spontaneous mutation","Chromosomal abnormality","","Speech therapy","Occupational therapy","Early intervention programs","Genetic counseling","Prenatal testing","Regular check-ups","Family history of 22q11.2 deletion syndrome","Prenatal diagnosis or newborn screening","Genetic testing (FISH@ microarray)","","Cardiac issues@ developmental delays@ and immune deficiencies","Affects approximately 1 in 4@000 live births.","Varies depending on the severity and specific symptoms.","Variable"
"58","22","22q11 Deletion Syndrome","A genetic disorder caused by a deletion on the long arm of chromosome 22@ resulting in a variety of developmental and health problems.","A protein involved in cell adhesion and signaling@ potentially affected by the 22q11 deletion.","10","10","MONDO:0002002","Yes","ARVCF","O00192","DisGeNET","2.5","0.8","0.5","0.3","SNPs@ Copy Number Variations","Calcium supplements@ Growth hormone","0.0001","ORPHANET","UMLS:C2936346","Phenotype to disease association","22q11.2 deletion syndrome","Heart defects","Palatal abnormalities","Learning disabilities","Immune deficiencies","Behavioral issues","Speech delays","Feeding difficulties","Kidney abnormalities","Skeletal problems","A condition caused by a small missing piece of chromosome 22@ resulting in a wide range of health and developmental problems.","Symptoms vary widely and can include heart defects@ palatal abnormalities@ learning disabilities@ immune deficiencies@ and behavioral issues.","The syndrome is caused by a deletion on the long arm of chromosome 22@ specifically the 22q11.2 region.","Deletion of 22q11.2 region","Genetic factors","Problems with the thymus","Problems with the parathyroid","Improper development of certain structures during gestation","NAN","Early intervention programs","Speech therapy","Occupational therapy","Genetic counseling","Prenatal testing","Avoiding known teratogens during pregnancy","Family history of 22q11.2 deletion syndrome","Infancy to childhood","Genetic mutations in the 22q11.2 region","Family history can increase the risk@ but most cases are new mutations.","Varies widely from mild to severe@ depending on the specific features affected.","Physical examination@ genetic testing (FISH@ microarray)","Heart problems@ immune deficiencies@ developmental delays@ psychiatric disorders","1 in 4@000 live births","Variable@ depending on the severity of the condition and the presence of complications."
"59","22","22q11 Deletion Syndrome","A genetic disorder caused by the deletion of a small piece of chromosome 22@ specifically in the region known as 22q11.2. This deletion leads to a variety of health issues affecting multiple systems of the body.","The protein encoded by this gene is involved in the degradation of catecholamines@ such as dopamine@ epinephrine@ and norepinephrine. It plays a crucial role in neurotransmitter metabolism and regulation of neuronal signaling.","10","10","MONDO:0005028","GARD:0007674","COMT","P21964","DisGeNET","5.2","0.85","0.5","0.36","Genetic variants influencing risk for 22q11.2 deletion syndrome","Risperidone@ Clonazepam","0.001","ORPHANET","UMLS:C2936346","Phenotype-driven analysis of 22q11.2 deletion syndrome","22q11.2 deletion syndrome","Heart defects","Palatal abnormalities","Immune system dysfunction","Learning difficulties","Developmental delays","Speech problems","Feeding difficulties","Kidney problems","Skeletal abnormalities","22q11.2 deletion syndrome is a genetic disorder caused by a missing piece of chromosome 22. This deletion can lead to a wide range of health problems@ including heart defects@ immune system issues@ and learning disabilities. The severity of symptoms varies among affected individuals.","Symptoms of 22q11.2 deletion syndrome are highly variable and can include congenital heart defects@ cleft palate@ distinctive facial features@ developmental delays@ learning disabilities@ and immune system problems. Some individuals may have mild symptoms@ while others experience more severe complications.","22q11.2 deletion syndrome is caused by a deletion of a small piece of chromosome 22@ specifically in the region 22q11.2. In most cases@ the deletion occurs randomly during the formation of reproductive cells (eggs or sperm) or early in fetal development.","Deletion of a small segment on chromosome 22","Genetic mutations","Spontaneous occurrence","Inherited from a parent (rare)","Variations in the size of the deleted region","Occupational therapy","Speech therapy","Educational support","Genetic counseling","Early intervention programs","Support groups","Heart defects","Immune deficiencies","Psychiatric disorders","Varying degrees of severity","Genetic testing (FISH or microarray)","Congenital heart disease","Developmental delays","Psychiatric illnesses","Estimated to affect 1 in 4@000 live births","Varies depending on the severity and types of symptoms","Close monitoring and management of symptoms"
"60","22","22q11 Deletion Syndrome","A genetic disorder caused by a small missing piece of the 22nd chromosome, near the middle of the chromosome at a location designated q11.2.","The function of the proteins affected by 22q11 deletion syndrome is variable depending on the specific genes deleted. Common genes affected include TBX1, involved in heart, great vessels, face, and thymus development; DGCR8, involved in microRNA processing; and COMT, involved in neurotransmitter metabolism.","10","10","MONDO:0002048","GARD:0007724","FGF8","P55075","DisGeNET","4.5","0.8","0.5","0.31","'1 PubMed IDs'","Olanzapine@ Aripiprazole","0.001","CTD_human","UMLS:C2936346","'Monarch:S2O:nan'","22q11.2 deletion syndrome","Heart defects","Immune deficiencies","Learning difficulties","Speech delays","Distinct facial features","Kidney abnormalities","Skeletal differences","Hearing loss","Psychiatric issues","22q11.2 deletion syndrome is a disorder caused by a missing piece of chromosome 22. This deletion can lead to a variety of health problems including heart defects, immune problems, developmental delays, and characteristic facial features. The severity of the condition can vary greatly among affected individuals.","Symptoms include heart defects@ poor immune function@ developmental delays@ learning disabilities@ speech difficulties@ distinct facial features@ kidney abnormalities@ skeletal differences@ hearing loss@ and psychiatric issues. The combination and severity of these symptoms vary widely.","The cause of 22q11.2 deletion syndrome is a deletion of a small piece of chromosome 22 at position q11.2. This deletion typically occurs randomly during the formation of egg or sperm cells@ or early in fetal development. It is rarely inherited.","De novo deletion","Rarely inherited from a parent with the deletion","N/A","N/A","N/A","Cardiac surgery","Immunoglobulin therapy","Early intervention services (speech therapy@ occupational therapy@ special education)","Avoid exposure to infections","Genetic counseling for parents planning future pregnancies","Early diagnosis and intervention","Family history of 22q11.2 deletion syndrome","Congenital (present at birth)","Genetic deletion on chromosome 22","Family history may or may not be present (often a new mutation)","Varies widely; can range from mild to severe","Genetic testing (FISH or microarray analysis)","Increased risk of infections@ autoimmune disorders@ seizures@ psychiatric disorders","Estimated to affect 1 in 4@000 live births","Variable; depends on the severity of the condition and associated health problems","NAN"
"61","22","22q11 Deletion Syndrome","A chromosomal deletion syndrome characterized by the deletion of a segment of chromosome 22 at position q11.2. It is associated with a variable phenotype including congenital heart defects@ velopharyngeal insufficiency@ developmental delay@ learning disabilities@ and characteristic facial features.","A syndrome caused by the deletion of a small piece of chromosome 22@ specifically the region q11.2. This deletion can lead to a wide range of health problems.","10","10","MONDO:0005008","GARD:00001","GP1BB","P13224","DisGeNET","2.5","0.8","0.5","0.3","SNP@ Genetic Variation","Clozapine@ Risperidone","0.001","ORPHANET","UMLS:C2936346","MONARCH:22q11.2 deletion syndrome","22q11.2 deletion syndrome","Heart defects","Cleft palate","Learning difficulties","Developmental delay","Immune deficiencies","Facial features (e.g.@ small ears@ almond-shaped eyes)","Speech delay","Feeding difficulties","Kidney abnormalities","22q11.2 deletion syndrome (also known as DiGeorge syndrome and velocardiofacial syndrome) is a genetic disorder caused by a missing piece of chromosome 22. This deletion affects many body systems and results in a wide range of signs and symptoms.","The symptoms of 22q11.2 deletion syndrome can vary widely in severity and presentation. Some individuals may have only mild symptoms@ while others may experience significant health problems.","22q11.2 deletion syndrome is caused by a deletion of a small segment of chromosome 22 at position q11.2. In most cases@ the deletion is not inherited but occurs randomly during the formation of sperm or egg cells@ or early in fetal development.","Deletion of 22q11.2","Genetic mutation","Spontaneous error","Family history","Environmental factors","Heart surgery","Speech therapy","Occupational therapy","Early intervention","Genetic counseling","Prenatal testing (if family history)","Avoidance of infections","Healthy lifestyle","Varies depending on the severity of symptoms. Genetic factors and family history increase the risk.","Most often diagnosed in infancy or early childhood.","Genetic factors play a central role.","Family history can increase the risk.","Varies from mild to severe depending on the specific features and complications.","Physical examination@ genetic testing (FISH or microarray)","Heart problems@ immune deficiencies@ learning disabilities@ psychiatric disorders","Estimated to affect 1 in 4@000 to 1 in 6@000 live births.","Variable@ depending on the severity of symptoms and access to appropriate medical care. Early diagnosis and intervention can improve outcomes.","Congenital heart defects@ velopharyngeal insufficiency@ developmental delay@ learning disabilities@ characteristic facial features","Heart defects","Palatal abnormalities","Hypocalcemia","Immune Deficiency"
"62","22","22q11 Deletion Syndrome","A genetic disorder caused by a deletion of a small piece of chromosome 22, specifically at position 22q11.2. This deletion leads to a variety of developmental and health problems.","The protein encoded by the genes within the 22q11.2 region plays various roles in development, particularly in the formation of the face, heart, and immune system. Loss of these proteins due to the deletion results in the observed clinical features.","10","10","MONDO:0002053","GARD:0000243","RREB1","Q92766","DisGeNET","0.5","0.8","0.2","0.3","SNPs@ Copy Number Variations","Calcium Supplements@ Growth Hormone","0.001","ORPHANET","UMLS:C2936346","NAN","22q11.2 Deletion Syndrome","Heart defects","Immune deficiencies","Learning disabilities","Distinctive facial features","Palate abnormalities","Kidney problems","Hearing loss","Skeletal abnormalities","Behavioral issues","22q11.2 deletion syndrome is a genetic disorder caused by a missing piece of chromosome 22. This deletion leads to a wide range of health and developmental problems@ including heart defects@ immune problems@ and learning difficulties. The severity and specific symptoms can vary greatly among individuals.","Symptoms of 22q11.2 deletion syndrome include heart defects@ immune deficiencies@ learning disabilities@ distinctive facial features@ palate abnormalities@ kidney problems@ hearing loss@ skeletal abnormalities@ and behavioral issues. The specific symptoms and their severity vary from person to person.","The primary cause of 22q11.2 deletion syndrome is the deletion of a small segment of chromosome 22 at the q11.2 position. This deletion typically occurs randomly during the formation of reproductive cells or early in embryonic development. In rare cases@ it can be inherited from a parent.","Deletion of 22q11.2 region","Spontaneous mutation","Inherited from a parent","Advanced maternal age","Environmental factors (limited evidence)","Heart surgery","Immune support","Speech therapy","Early intervention programs","Special education","Behavioral therapy","Avoid known teratogens during pregnancy","Genetic counseling for affected families","Prenatal testing for high-risk pregnancies","Family history of 22q11.2 deletion syndrome","Early childhood (infancy or early childhood)","Genetic mutations affecting the 22q11.2 region","Family history of chromosome 22q11.2 deletion syndrome","Varies widely@ ranging from mild to severe","Chromosomal microarray analysis (CMA)","Fluorescence in situ hybridization (FISH)","Heart failure","Recurrent infections","Developmental delays","Psychiatric disorders","Varies depending on the severity of the condition and the specific complications. Estimated to affect 1 in 4000 live births.","The prognosis varies depending on the severity of the symptoms and the effectiveness of treatment. With early diagnosis and comprehensive management@ individuals with 22q11.2 deletion syndrome can lead fulfilling lives."
"63","22","22q11 Deletion Syndrome","A genetic disorder caused by the deletion of a small piece of chromosome 22@ leading to a variety of developmental and health issues.","Transcription factor involved in the development of the pharyngeal arches.","10","10","MONDO:0005008","Yes","TBX1","O43435","DisGeNET","4.5","0.8","0.5","0.39","Varied@ including SNPs","Calcium Supplements","0.0001","ORPHANET","UMLS:C2936346","Poor @ depending on severity and organs affected","22q11.2 deletion syndrome","Heart Defects","Immune Deficiencies","Learning Disabilities","Speech Delay","Feeding Problems","Kidney Abnormalities","Skeletal Anomalies","Hearing Loss","Behavioral Problems","22q11.2 deletion syndrome is a genetic disorder caused by the deletion of a small segment of chromosome 22@ leading to a wide range of developmental and health issues.","Symptoms vary widely but commonly include heart defects@ immune deficiencies@ learning disabilities@ speech delay@ feeding problems@ kidney abnormalities@ skeletal anomalies@ hearing loss@ and behavioral problems.","Caused by a deletion on chromosome 22q11.2@ typically a de novo mutation but can be inherited.","Deletion of 22q11.2 Chromosome","Genetic Factors","Disrupted Development","Immune System Problems","Heart Development Issues","Nutritional Support","Speech Therapy","Educational Interventions","Genetic Counseling","Prenatal Testing","Family Planning","Genetic factors@ specifically a deletion on chromosome 22q11.2.","Often diagnosed in infancy or early childhood.","22q11.2 deletion is a genetic condition.","Increased risk if a parent has the deletion.","Variable@ ranging from mild to severe depending on the extent of the deletion and the organs affected.","Genetic Testing@ FISH analysis@ Chromosomal Microarray Analysis.","Heart Failure@ Hypocalcemia@ Autoimmune Disorders@ Psychiatric Disorders.","Incidence is approximately 1 in 4000 live births.","Variable@ depending on the severity of the condition and the presence of complications."
"64","22","22q11 Deletion Syndrome","A genetic disorder caused by a microdeletion in chromosome 22@ specifically in the region 22q11.2@ leading to a variety of developmental and health issues.","A protein involved in chromatin assembly and transcriptional regulation@ often associated with genomic stability and DNA replication.","10","10","MONDO:0002008","GARD:0007542","HIRA","P54198","DisGeNET","4.5","0.85","0.2","0.32","Associated with SNPs in the region of the deletion.","Calcium supplements@ Vitamin D supplements","0.0005","ORPHANET","UMLS:C2936346","Monarch:S2O-0000001","DiGeorge Syndrome (22q11.2 deletion syndrome)","Heart defects","Immune deficiencies","Learning difficulties","Distinctive facial features","Palatal abnormalities","Hypocalcemia","Delayed development","Speech and language delays","Kidney problems","22q11.2 deletion syndrome is a genetic disorder that results from a small missing piece of chromosome 22. The deletion occurs near the middle of the chromosome at a location designated q11.2. This region contains about 30 to 40 genes. While the exact number of missing genes may vary@ many of the signs and symptoms of 22q11.2 deletion syndrome are thought to be related to the loss of particular genes in this region.","Symptoms include heart defects@ immune problems@ learning difficulties@ and distinctive facial features.","The syndrome is caused by a deletion of a small piece of chromosome 22.","Deletion in the 22q11.2 region","Genetic mutations","Inheritance","Environmental factors","Unknown","Calcium supplementation","Immunoglobulin therapy","Physical@ occupational@ and speech therapy","Genetic counseling","Prenatal testing","Avoidance of infections","Family history of the syndrome","Infancy or early childhood","Genetic factors are a primary cause@ specifically the 22q11.2 deletion.","Family history can increase the risk@ though most cases are new mutations.","Variable@ ranging from mild to severe depending on the extent and specific genes involved in the deletion.","Genetic testing (FISH@ microarray)@ physical exam@ and evaluation of symptoms.","Heart problems@ immune disorders@ developmental delays@ mental health issues.","Approximately 1 in 4@000 live births.","Varies depending on the severity and specific complications@ but can include lifelong challenges.",""
