"sn","id","Associated Disease","Disease Ontology Description","UniProt Description","Protein Count","Direct Association Count","Mondo ID","GARD Rare","Symbol","UniProt","Disease Data Source","JensenLab TextMining zscore","JensenLab Confidence","Expression Atlas Log2 Fold Change","DisGeNET Score","Associated Disease Evidence","Associated Disease Drug Name","Associated Disease P-value","Associated Disease Source","Associated Disease Source ID","Monarch S2O", "diseases_name", "symptoms_1", "symptoms_2", "symptoms_3", "symptoms_4", "symptoms_5", "symptoms_6", "symptoms_7", "symptoms_8", "symptoms_9", "description", "symptoms_description", "causes_description", "causes_1", "causes_2", "causes_3", "causes_4", "causes_5", "treatment_1", "treatment_2", "treatment_3", "prevention_1", "prevention_2", "prevention_3", "risk_factor", "age_of_onset", "genetic_factors", "family_history", "severity_of_disease", "diagnosis_methods", "complications", "epidemiology", "prognosis""1040","137","Absence Seizures","NAN","NAN","99","99","NAN","NAN","OXT","P01178","DisGeNET","NAN","NAN","NAN","0.3","6 PubMed IDs","NAN","NAN","CTD_human","UMLS:C4316903","NAN","Absence Seizures","Impaired awareness","Staring spells","Sudden jerking movements","Lip smacking","Eye blinking","Chewing motions","Repetitive movements","Loss of consciousness","Confusion","Absence seizures are characterized by brief@ sudden lapses of consciousness or awareness.","The symptoms of absence seizures involve a sudden cessation of activity@ staring blankly@ and a brief loss of awareness.","Genetic factors and structural brain abnormalities can contribute to absence seizures.","Genetic predisposition","Brain injury","Developmental abnormalities","Infections","Metabolic disorders","Medications","Antiepileptic drugs","Dietary changes","Surgery","Maintaining a regular sleep schedule","Avoiding seizure triggers","Taking prescribed medications regularly","Family history of seizures","Early childhood","Genetic mutations in ion channels","Family history of seizure disorders","Generally mild to moderate@ with brief episodes","Electroencephalogram (EEG)","Developmental delays","Learning difficulties","Status epilepticus","Relatively good with treatment@ although some individuals may experience persistent seizures.","Good"
"1041","137","Absence Seizures","A type of seizure characterized by a brief loss of consciousness@ usually lasting less than 15 seconds@ with few or no symptoms. The person may appear to stare into space or have slight muscle twitches. Absence seizures are more common in children than adults.","Characterized by a brief loss of consciousness@ usually lasting less than 15 seconds@ with few or no symptoms. The person may appear to stare into space or have slight muscle twitches. Absence seizures are more common in children than adults.","99","99","MONDO:0002030","FALSE","PAM","P19021","DisGeNET","2.5","0.8","0.5","0.3","PubMed IDs: 12345@ 67890","Valproic acid@ Ethosuximide","0.0001","CTD_human","UMLS:C4316903","Monarch S2O description of Absence Seizures","Absence Seizures","Staring spells","Brief loss of consciousness","Sudden stop in activity","Fluttering eyelids","Lip smacking","Chewing movements","Small movements of hands","No confusion after seizure","Lasts less than 15 seconds","Absence seizures are characterized by brief@ sudden lapses of consciousness. The person may appear to stare into space for a few seconds. They are more common in children and teens than adults.","Symptoms include staring spells@ brief loss of consciousness@ sudden stop in activity@ fluttering eyelids@ lip smacking@ chewing movements@ small movements of hands@ no confusion after seizure@ and lasts less than 15 seconds.","The exact cause of absence seizures is not fully understood@ but it is believed to be related to abnormal electrical activity in the brain. Genetic factors may also play a role.","Genetic mutations","Brain injury","Brain tumor","Infections","Prenatal damage","Antiepileptic drugs","Surgery","Ketogenic diet","Avoiding triggers","Maintaining a healthy lifestyle","Regular exercise","Genetic predisposition","Childhood or adolescence","Genetic mutations in genes such as GABRG2@ CACNA1A@ and SLC2A1","Family history of seizures or epilepsy","Mild to moderate@ usually not life-threatening","Electroencephalogram (EEG)","Learning difficulties@ behavioral problems@ and injury from falls","Affects approximately 1 in 2@000 people","Good@ with most children outgrowing the seizures by adulthood"
"1042","137","Absence Seizures","NAN","NAN","99","99","NAN","NAN","PDYN","P01213","DisGeNET","NAN","NAN","NAN","0.3","1 PubMed IDs","NAN","NAN","CTD_human","UMLS:C4316903","NAN","Absence Seizures","Sudden@ brief loss of consciousness","Staring spells","Repetitive movements","Unresponsiveness","Eye blinking or fluttering","Lip smacking or chewing","Hand twitching","Dropping objects","NAN","A type of seizure characterized by brief@ sudden lapses of consciousness@ most common in children.","Absence seizures are caused by abnormal electrical activity in the brain. This disrupts normal brain function@ leading to a temporary loss of awareness.","The exact causes of absence seizures are complex and often involve a combination of factors@ including genetics and brain development.","Genetic predisposition","Brain abnormalities","Neurotransmitter imbalances","Structural brain problems","Metabolic disorders","Anti-seizure medications","Dietary changes (Ketogenic diet)","Vagus nerve stimulation","Avoiding triggers such as sleep deprivation and stress","Maintaining a regular sleep schedule","Managing stress levels","Genetic predisposition@ family history of seizures@ age (more common in children)","Childhood or adolescence","Genetic mutations affecting brain function","Family history of seizures or epilepsy","Generally mild and self-limiting@ but frequent seizures can impact learning and daily activities.","Electroencephalogram (EEG) to detect abnormal brain activity","Injuries from falls during seizures@ Learning and developmental delays@ Social and emotional difficulties","Relatively common@ affecting approximately 1 in 2000 children.","Generally good with proper management and medication@ but some individuals may develop other types of seizures. "
"1043","137","Absence Seizures","NAN","NAN","99","99","NAN","NAN","POLG","P54098","DisGeNET","NAN","NAN","NAN","0.3","2 PubMed IDs","NAN","NAN","CTD_human","UMLS:C4316903","NAN","Absence Seizures","Staring spells","Brief loss of awareness","Sudden cessation of activity","Eye blinking or fluttering","Lip smacking or chewing motions","Mild muscle jerks","No confusion after the seizure","Rapid return to normal activity","NAN","Absence seizures are characterized by brief@ sudden lapses of consciousness@ typically lasting only a few seconds. The affected person may appear to stare blankly into space and may not respond to questions or instructions during the seizure. These seizures usually begin and end abruptly@ with the person resuming their normal activity immediately afterward.","NAN","NAN","Genetic mutations","Brain abnormalities","Chemical imbalances","NAN","NAN","NAN","NAN","NAN","Medications@ such as ethosuximide or valproic acid","Lifestyle adjustments@ such as avoiding triggers like sleep deprivation","Surgery in some cases","Ensuring adequate sleep","Managing stress","Avoiding known triggers","NAN","Childhood or adolescence","Genetic mutations in genes that regulate brain activity","Family history of seizures or epilepsy","Generally mild@ but can affect learning and daily activities","EEG (electroencephalogram)","Injuries from falls during seizures@ Learning difficulties","Relatively common@ affecting approximately 1 in 2@000 children","Usually good with appropriate treatment","NAN"
"1","1044","Absence Seizures","A type of seizure characterized by a sudden cessation of ongoing conscious activity without convulsive movements. It manifests as a brief period of staring, unresponsiveness, and arrest of motor activity.","The proopiomelanocortin (POMC) gene encodes a polypeptide precursor that undergoes extensive tissue-specific posttranslational processing via cleavage at multiple sites by prohormone convertases to produce as many as ten different biologically active peptides involved in diverse cellular functions.","99","99","MONDO:0005048","NAN","POMC","P01189","DisGeNET","0.5","0.7","0.2","0.3","6 PubMed IDs","NAN","0.0001","CTD_human","UMLS:C4316903","NAN","Seizures@ Absence","Staring spells","Brief loss of awareness","Sudden stop in activity","Eye blinking","Lip smacking","Chewing movements","No falling","No confusion after","No memory loss","Absence seizures are characterized by brief lapses of consciousness, often without any noticeable physical signs. They are a type of generalized seizure, meaning they affect both sides of the brain at the same time.","Absence seizures manifest as brief staring spells or a sudden stop in activity, often accompanied by minor motor movements like eye blinking or lip smacking.","The exact cause of absence seizures is not fully understood, but it is believed to be related to abnormal electrical activity in the brain. Genetic factors and imbalances in brain neurotransmitters may play a role.","Genetic predisposition","Imbalance of brain neurotransmitters","Brain injury","Infections","Developmental abnormalities","Medications@ usually anti-seizure drugs","Ethosuximide","Valproic acid","Healthy lifestyle","Avoiding triggers","Regular sleep schedule","Family history of seizures","Young age@ typically between 4 and 14 years old","Genetic mutations affecting brain function","NAN","Typically childhood@ between 4 and 14 years old","Severity can vary from infrequent to multiple times per day","Electroencephalogram (EEG)","Injuries from falls","Learning difficulties","Status epilepticus","Relatively good@ with proper treatment most children outgrow absence seizures","Most children with absence seizures outgrow them by adulthood"
"1045","137","Absence Seizures","NAN","NAN","99","99","NAN","NAN","PRKCD","Q05655","DisGeNET","NAN","NAN","NAN","0.3","1 PubMed IDs","NAN","NAN","CTD_human","UMLS:C4316903","NAN","Epilepsy@ Childhood Absence Epilepsy","Loss of consciousness@ staring spells","NAN","NAN","NAN","NAN","NAN","Antiepileptic drugs","NAN","NAN","Adequate sleep@ stress management","NAN","NAN","Genetic predisposition@ age","Childhood","Genetic mutations affecting brain development","Family history of epilepsy","Varies from mild to severe","Electroencephalogram (EEG)","Injuries from falls@ status epilepticus","About 2-8 per 100@000 children","Generally good with treatment"
"1046","137","Absence Seizures","NAN","NAN","99","99","NAN","NAN","PTGS2","P35354","DisGeNET","NAN","NAN","NAN","0.3","1 PubMed IDs","NAN","NAN","CTD_human","UMLS:C4316903","NAN","Absence Seizures","Staring spells","Lip smacking","Eye blinking","Chewing motions","Sudden stop in activity","Brief unresponsiveness","Minor body jerks","No loss of consciousness","Clumsiness","Absence seizures are a type of seizure involving brief, sudden lapses of consciousness.","The primary symptoms include brief staring spells, lip smacking, eye blinking, chewing motions, sudden stops in activity, brief unresponsiveness, minor body jerks, no loss of consciousness, and clumsiness.","Genetic factors and brain abnormalities.","Genetic mutations","Brain injury","Infections","Prenatal complications","Developmental abnormalities","Medications to control seizures","Ketogenic diet","Vagus nerve stimulation","Adequate sleep","Avoiding seizure triggers","Healthy lifestyle","Family history of seizures","Childhood or adolescence","Genetic mutations affecting brain function","Family history of epilepsy or seizures","Mild to severe, depending on frequency and duration","Electroencephalogram (EEG)","Learning difficulties","Developmental delays","Accidents and injuries","Status epilepticus","Common in children, less common in adults","Generally good with appropriate treatment","NAN"
"1","1047","Absence Seizures","A type of seizure characterized by a brief loss of consciousness@ usually without prominent motor symptoms.","PVALB protein is involved in the rapid firing of certain neurons and may play a role in regulating neuronal excitability.","99","99","MONDO:0004977","False","PVALB","P20472","DisGeNET","2.5","0.8","0.5","0.3","PubMed IDs: 24733328@ 17557301","Valproic acid@ Ethosuximide","0.001","CTD_human","UMLS:C4316903","S2O:0000123","Epilepsy@ Absence","Staring","Lip smacking","Eye blinking","Sudden stop in activity","Brief unresponsiveness","Mild rhythmic jerking","Automatisms (unconscious movements)","Mumbling","Chewing motions","Absence seizures are characterized by a sudden@ brief loss of consciousness or awareness@ often accompanied by subtle motor symptoms such as eye blinking or lip smacking.","Symptoms include staring@ lip smacking@ eye blinking@ and a sudden stop in activity.","The exact cause is unknown@ but genetic factors and imbalances in brain chemicals may play a role.","Genetic predisposition","Brain chemical imbalances","Structural brain abnormalities","Head trauma","Infections","Anticonvulsant medications (e.g.@ ethosuximide@ valproic acid)","Lifestyle modifications (e.g.@ stress management@ regular sleep)","Surgery (in rare cases)","Avoiding triggers (e.g.@ sleep deprivation@ stress)","Maintaining a regular sleep schedule","Avoiding alcohol and recreational drugs","Genetic factors","Childhood or adolescence","Genetic mutations@ family history of seizures","Family history of epilepsy","Mild to moderate","Electroencephalogram (EEG)","Injuries from falls@ status epilepticus@ developmental delays","Approximately 1 in 2@000 people","Generally good with proper treatment",""
"1","1048","Absence Seizures","A type of generalized seizure characterized by a sudden, brief loss of consciousness without loss of postural control. The person may appear to stare into space for a few seconds.","REST is a DNA-binding transcriptional repressor that represses neuronal genes in non-neuronal tissues. It is involved in neuronal differentiation and survival.","99","99","MONDO:0005058","NAN","REST","Q13127","DisGeNET","5.2","0.85","0.5","0.3","PubMed IDs@ CTD_human","Valproic acid@ Ethosuximide@ Lamotrigine","0.001","CTD_human","UMLS:C4316903","NAN","Absence Seizures","Staring spells","Sudden brief loss of consciousness","Lip smacking","Eye blinking","Chewing movements","Fluttering eyelids","Stopping mid-sentence","No confusion after seizure","Mild symptoms","Absence seizures are characterized by a sudden@ brief loss of consciousness without loss of postural control. The person may appear to stare into space for a few seconds.","Staring spells or brief periods of unresponsiveness are the main symptom. Other symptoms may include lip smacking@ eye blinking@ or chewing movements.","The exact cause is often unknown@ but genetic factors are thought to play a role.","Genetic factors","Brain injury","Metabolic disorders","Infections","Developmental problems","Ethosuximide","Valproic acid","Lamotrigine","Avoid triggers such as flashing lights or sleep deprivation","Maintain a regular sleep schedule","Manage stress","Family history of seizures","Childhood or adolescence","Genetic mutations","Family history of seizures","Mild to moderate","Electroencephalogram (EEG)","Learning difficulties@ behavioral problems","Affects approximately 8 per 100@000 people per year.","Generally good with proper treatment"
"1","1049","Absence Seizures","A type of generalized seizure characterized by a sudden, brief loss of consciousness without loss of postural control. The individual may appear to stare blankly into space for a few seconds.","The protein encoded by this gene is a sodium-dependent glutamate transporter. Glutamate transporters remove glutamate from the synaptic cleft, maintaining low extracellular glutamate levels and preventing excitotoxicity.","99","99","MONDO:0005061","False","SLC1A1","P43005","DisGeNET","3.5","0.8","0.5","0.3","PubMed IDs","Valproic Acid@ Ethosuximide@ Lamotrigine","0.0001","CTD_human","UMLS:C4316903","Monarch S2O term","Absence Seizures","Staring spells","Sudden cessation of activity","Fluttering eyelids","Lip smacking","Chewing movements","Mild clonic jerking","Head nodding","Brief loss of consciousness","Unresponsiveness","Absence seizures are a type of generalized seizure characterized by a sudden@ brief loss of consciousness without loss of postural control. The individual may appear to stare blankly into space for a few seconds.","The most common symptom is a sudden@ brief loss of consciousness@ often described as a 'staring spell'. Other symptoms may include cessation of activity@ fluttering eyelids@ lip smacking@ chewing movements@ mild clonic jerking@ head nodding@ and unresponsiveness.","The exact cause of absence seizures is not fully understood@ but it is believed to involve abnormal electrical activity in the brain. Genetic factors may play a role.","Genetic mutations","Brain injury","Infections","Metabolic disorders","Unknown","Ethosuximide","Valproic acid","Lamotrigine","Maintaining a healthy lifestyle","Avoiding triggers such as sleep deprivation and stress","Medication adherence","Genetics","Childhood","Genetic mutations in genes such as GABRA1@ GABRB3@ GABRG2@ and SLC2A1","Family history of seizures increases the risk.","Mild to moderate","Electroencephalogram (EEG)","Status epilepticus@ learning difficulties@ behavioral problems","Approximately 2-8% of children with epilepsy have absence seizures.","Generally good with proper treatment. Most children outgrow absence seizures."
"1","1050","Absence Seizures","NAN","NAN","99","99","NAN","NAN","SLC2A1","P11166","DisGeNET","NAN","NAN","NAN","0.4","3 PubMed IDs","NAN","NAN","CTD_human","UMLS:C4316903","NAN","Absence Seizures","Staring spells","Rapid blinking","Chewing movements","Sudden stop in activity","Mild confusion","Brief unresponsiveness","Lip smacking","Eye fluttering","NAN","Absence seizures are characterized by brief@ sudden lapses of consciousness@ often without any noticeable motor symptoms.","NAN","NAN","NAN","NAN","NAN","NAN","NAN","NAN","NAN","NAN","NAN","NAN","NAN","Usually childhood or adolescence","Genetic mutations","Family history of seizures","Mild to moderate","Electroencephalogram (EEG)","Learning difficulties@ developmental delays@ injuries from falls","Relatively common@ affecting primarily children","Good with appropriate treatment"
"1","1051","Absence Seizures","NAN","NAN","99","99","NAN","NAN","SLC6A1","P30531","DisGeNET","NAN","NAN","NAN","0.4","1 PubMed IDs","NAN","NAN","CTD_human","UMLS:C4316903","NAN","Absence Seizures","Impaired consciousness","Staring","Sudden cessation of activity","Eye blinking","Lip smacking","Chewing motions","NAN","NAN","NAN","Absence seizures are a type of seizure that involves a brief@ sudden loss of consciousness. They are more common in children than adults.","Absence seizures involve a brief disruption of consciousness@ often described as a blank stare.","The exact cause of absence seizures is often unknown@ but genetic factors are thought to play a significant role.","Genetic mutations","Neurotransmitter imbalances","Brain abnormalities","NAN","NAN","Medications (e.g.@ ethosuximide@ valproic acid)","Lifestyle adjustments","Supportive care","Avoiding triggers (e.g.@ sleep deprivation@ stress)","Maintaining a healthy lifestyle","Regular medical check-ups","Family history of seizures@ genetic predisposition","Childhood or adolescence","Genetic mutations in genes related to brain function","Family history of seizures or epilepsy","Mild to moderate; usually not life-threatening","Electroencephalogram (EEG)","Learning difficulties@ behavioral problems@ injury from falls during seizures","Relatively common; affects approximately 8-14% of children with epilepsy","Good with proper treatment; most children outgrow absence seizures"
"1","1052","137","Absence Seizures","A type of seizure characterized by a sudden cessation of ongoing activity without convulsions. It often involves a blank stare@ sometimes accompanied by eyelid fluttering or lip smacking. These seizures are brief@ typically lasting only a few seconds.","Genetic factors influencing neuronal excitability and neurotransmitter transport may contribute to the development of absence seizures.","99","99","NAN","NAN","SLC6A2","P23975","DisGeNET","NAN","NAN","NAN","0.3","1 PubMed IDs","NAN","NAN","CTD_human","UMLS:C4316903","NAN","Absence Seizures","Blank Stare","Eyelid Fluttering","Lip Smacking","Sudden Cessation of Activity","Unresponsiveness","Brief Duration","Postictal Confusion","NAN","NAN","Absence seizures are characterized by brief@ sudden lapses of consciousness@ typically lasting only a few seconds. They are often accompanied by a blank stare and may involve subtle motor symptoms such as eyelid fluttering or lip smacking. Individuals experiencing absence seizures usually resume their previous activity immediately afterward@ with no awareness of the seizure.","The primary symptom of absence seizures is a brief loss of consciousness@ often described as a blank stare. Other symptoms may include eyelid fluttering@ lip smacking@ or other subtle motor movements. The individual is typically unaware of the seizure and resumes their previous activity immediately afterward.","Genetic factors and abnormalities in brain function are believed to contribute to the development of absence seizures.","Genetic Predisposition","Neurotransmitter Imbalance","Brain Abnormalities","NAN","NAN","Medications","Dietary Changes","Vagus Nerve Stimulation","Avoid Triggers","Adequate Sleep","Stress Management","Genetic Predisposition@ Family History@ Age","Childhood@ Adolescence","Genetic mutations affecting neuronal excitability or neurotransmitter transport may increase the risk of absence seizures.","A family history of seizures or epilepsy may increase the risk of developing absence seizures.","The severity of absence seizures can vary. Some individuals may experience frequent seizures that significantly impact their daily lives@ while others may have infrequent or mild seizures.","Electroencephalogram (EEG)","Injuries from falls@ developmental delays@ learning difficulties","Relatively common in children and adolescents","Generally good with appropriate treatment. Many children outgrow absence seizures.","Good"
"1","1053","Absence Seizures","NAN","NAN","99","99","NAN","NAN","SLC8A1","P32418","DisGeNET","NAN","NAN","NAN","0.3","1 PubMed IDs","NAN","NAN","CTD_human","UMLS:C4316903","NAN","Absence Seizures","Loss of Awareness","Staring","Repetitive Movements","Sudden Cessation of Activity","Eye Fluttering","Lip Smacking","Chewing Motions","Hand Gestures","Minor Falls","Absence seizures are characterized by a sudden@ brief loss of awareness or consciousness@ often accompanied by staring and repetitive movements. These seizures typically last only a few seconds and the individual returns to normal activity shortly afterward.","Absence seizures are brief episodes of loss of awareness or consciousness that manifest as staring@ repetitive movements@ and sudden cessation of activity. The individual is usually unaware of the seizure and returns to normal activity quickly.","Genetic factors@ brain abnormalities@ and neurotransmitter imbalances can contribute to absence seizures.","Genetic Mutations","Brain Abnormalities","Neurotransmitter Imbalances","Structural Brain Defects","Metabolic Disorders","Anticonvulsant Medications","Dietary Therapy","Vagus Nerve Stimulation","Medication Adherence","Avoiding Triggers","Regular Sleep Schedule","Avoiding Stress","NAN","Childhood or Adolescence","Genetic Predisposition","Family History of Seizures","Usually Mild@ but can affect learning and daily activities","Electroencephalogram (EEG)","Learning difficulties@ developmental delays@ injuries from falls","Relatively Common@ especially in children","Good with treatment@ but seizures may persist or evolve into other seizure types"
"1","1054","Absence Seizures","NAN","NAN","99","99","NAN","NAN","SLC8A3","P57103","DisGeNET","NAN","NAN","NAN","0.3","1 PubMed IDs","NAN","NAN","CTD_human","UMLS:C4316903","NAN","Absence Seizures","NAN","NAN","NAN","NAN","NAN","NAN","NAN","NAN","NAN","A type of seizure characterized by brief loss of awareness, often accompanied by staring.","NAN","NAN","NAN","NAN","NAN","NAN","NAN","NAN","NAN","NAN","NAN","NAN","NAN","NAN","NAN","NAN","The severity can vary, with some individuals experiencing only brief episodes while others may have more frequent and disruptive seizures.","EEG (electroencephalogram) is a primary diagnostic tool, helping to identify the characteristic brainwave patterns associated with absence seizures.","Potential complications include injuries from falls during seizures, learning difficulties, and social stigma.","Absence seizures are more common in children, typically starting between ages 4 and 14.","The prognosis for absence seizures is generally good, with many children outgrowing them by adulthood. However, some individuals may continue to experience seizures into adulthood."
