"1","1070","Absence Seizures","NAN","NAN","99","99","NAN","NAN","RBFOX1","Q9NWB1","DisGeNET","NAN","NAN","NAN","0.3","1 PubMed IDs","NAN","NAN","CTD_human","UMLS:C4316903","NAN","Absence Seizures","Staring spells","Sudden stop in activity","Lip smacking","Eye blinking","Chewing motions","Finger rubbing","Small movements of both arms","NAN","NAN","Absence seizures are characterized by brief@ sudden lapses of consciousness. The individual may appear to be staring into space or may have subtle body movements such as eye blinking or lip smacking. These seizures usually last only a few seconds.","Absence seizures involve a sudden@ brief loss of consciousness@ causing a blank stare or pause in activity.","Genetic factors and certain underlying medical conditions can contribute to absence seizures.","Genetic predisposition","Brain injury","Infections affecting the brain","Metabolic imbalances","Developmental disorders","Antiepileptic medications (e.g.@ ethosuximide@ valproic acid)","Lifestyle adjustments to minimize triggers","Regular follow-up with a neurologist","Avoidance of known seizure triggers (e.g.@ flashing lights@ sleep deprivation)","Adherence to prescribed medication regimen","Protective measures during activities that could be dangerous if a seizure occurs","Family history of seizures","Childhood or adolescence","Genetic mutations affecting brain function","Family history of epilepsy or seizures","Usually mild and self-limiting@ but can impact daily life and learning","Electroencephalogram (EEG)","Injury from falls during seizures@ learning difficulties","Relatively common in childhood@ affecting 1 in 1@000 people","Generally good with appropriate treatment@ seizures can usually be controlled"
"1","1071","Absence Seizures","A type of seizure characterized by a brief loss of consciousness without prominent motor symptoms. The individual may appear to stare blankly into space.","CNNM2 (Cyclin and CBS domain divalent metal cation transport mediator 2) is a protein involved in magnesium transport. Mutations can be associated with hypomagnesemia and seizures.","99","99","MONDO:0005042","false","CNNM2","Q9H8M5","DisGeNET","4.5","0.8","0.5","0.3","Associated with 1 PubMed ID","Valproic acid@ Ethosuximide@ Lamotrigine","0.0001","CTD_human","UMLS:C4316903","MONARCH:S2O:0000079","Absence Seizures","Staring spells","Sudden stop in activity","Lip smacking","Eye blinking","Chewing motions","Small movements of hands","Brief unresponsiveness","None","NAN","Absence seizures are characterized by brief lapses of consciousness, often resembling daydreaming or staring into space. These seizures typically last for only a few seconds and can occur multiple times a day.","The main symptom of absence seizures is a brief lapse of consciousness, often described as a blank stare or daydreaming. Other symptoms may include subtle motor movements, such as lip smacking or eye blinking.","Genetic factors play a significant role in the development of absence seizures. Mutations in certain genes involved in neuronal excitability and inhibition can increase susceptibility to these seizures.","Genetic mutations in genes such as GABRG2@ CACNA1A@ and SLC2A1","Changes in brain chemistry@ particularly involving GABA and glutamate","Structural abnormalities in the brain","Brain tumors","Head trauma","NAN","Ethosuximide","Valproic acid","Lamotrigine","Avoiding triggers such as flashing lights or hyperventilation","Maintaining a regular sleep schedule","Managing stress","Family history of seizures","Childhood@ typically between the ages of 4 and 14","Genetic mutations and imbalances in brain chemistry","Family history of absence seizures","Usually mild@ but can interfere with learning and daily activities","Electroencephalogram (EEG) to detect abnormal brain activity","Learning difficulties","Developmental delays","Affects approximately 1 in 2@000 children","Good with proper treatment@ with many children outgrowing the condition","NAN"
"1","1072","Absence Seizures","A type of seizure characterized by a sudden cessation of ongoing conscious activity without convulsive movements. It manifests with a blank stare@ sometimes accompanied by brief upward deviation of the eyes and/or mild clonic movements of the eyelids.","PLPPR1_HUMAN: This protein is a transmembrane protein of unknown function. It may be involved in cell signaling or transport processes.","99","99","MONDO:0002024","False","PLPPR1","Q8TBJ4","DisGeNET","2.5","0.8","0.5","0.3","PubMed IDs: 28830454","Valproic Acid","0.001","CTD_human","UMLS:C4316903","NAN","Absence Seizures","Staring spells","Sudden cessation of activity","Eye blinking","Mild clonic movements of eyelids","Unresponsiveness","Brief duration (usually less than 15 seconds)","No post-seizure confusion","NAN","Absence seizures are a type of generalized seizure characterized by brief losses of consciousness@ typically lasting only a few seconds. They are more common in children and often manifest as staring spells.","The exact cause of absence seizures is not fully understood@ but it is believed to involve genetic factors and abnormalities in brain electrical activity.","Genetic predisposition","Brain electrical activity abnormalities","Neurotransmitter imbalances","NAN","NAN","NAN","NAN","NAN","Ethosuximide","Valproic Acid","Lamotrigine","Avoiding triggers such as sleep deprivation and stress","Maintaining a regular sleep schedule","Following prescribed medication regimen","Family history of seizures@ genetic factors@ age (more common in children)","Childhood (typically between 4 and 14 years old)","Genetic mutations affecting brain electrical activity","Family history of epilepsy or seizure disorders","Mild to moderate; usually does not cause lasting harm@ but frequent seizures can affect learning and development","Electroencephalogram (EEG) to detect characteristic spike-and-wave patterns","Learning difficulties@ developmental delays@ increased risk of other seizure types","Affects approximately 1 in 2@000 children; more common in girls","Generally good with appropriate treatment; many children outgrow absence seizures","NAN"
"1","1073","Absence Seizures","NAN","NAN","99","99","NAN","NAN","SLC17A7","Q9P2U7","DisGeNET","NAN","NAN","NAN","0.3","1 PubMed IDs","NAN","NAN","CTD_human","UMLS:C4316903","NAN","Absence Seizures","Impaired consciousness","Staring spells","Sudden jerking movements","Brief unresponsiveness","Repetitive behaviors","Eye blinking","Lip smacking","Chewing motions","NAN","Absence seizures are a type of seizure characterized by a brief loss of consciousness@ often accompanied by staring spells and repetitive movements. They typically last for only a few seconds and the individual usually returns to normal activity immediately afterwards.","The symptoms of absence seizures can vary@ but often include staring spells@ impaired consciousness@ and repetitive movements such as eye blinking or lip smacking. Individuals may also experience sudden jerking movements or brief unresponsiveness.","The exact cause of absence seizures is not fully understood@ but it is believed to be related to abnormal electrical activity in the brain. Genetic factors may also play a role in some cases.","Genetic mutations","Neurotransmitter imbalances","Brain injury","Infections","Hormonal changes","Antiepileptic medications","Therapy","Lifestyle adjustments","Avoid triggers","Maintain healthy sleep habits","Manage stress","Genetic predisposition","Childhood","Family history of seizures","NAN","Variable@ ranging from mild to severe","Electroencephalogram (EEG)","Learning disabilities","Developmental delays","Accidents","Relatively common@ affecting children and adolescents","Generally good with proper management"
"1","1074","137","Absence Seizures","Seizures characterized by sudden, brief loss of consciousness without loss of postural control.","Sudden, brief loss of consciousness","99","99","MONDO:0005042","GARD:0007684","SLC12A5","Q9H2X9","DisGeNET","2.5","0.8","0.5","0.3","PubMed IDs","Valproic Acid@ Ethosuximide","0.0001","CTD_human","UMLS:C4316903","Monarch Initiative","Absence Seizures","Staring Spells","Lip Smacking","Eye Fluttering","Sudden Cessation of Activity","Unresponsiveness","Brief Loss of Consciousness","No Postural Control Loss","Occasional Automatisms","nan","Absence seizures are characterized by brief@ sudden lapses of consciousness@ causing a blank stare and unresponsiveness.","Genetic mutations@ brain abnormalities@ and developmental factors may contribute to absence seizures.","Genetic Mutations","Brain Abnormalities","Developmental Factors","Hyperventilation","Sleep Deprivation","Ethosuximide","Valproic Acid","Lamotrigine","Regular Sleep Schedule","Avoidance of Triggers","Healthy Diet","Genetic Predisposition","Childhood","Genetic Mutations in SLC12A5","Family History of Epilepsy","Mild to Moderate","EEG","Developmental Delays","Relatively Common in Children","Good with Treatment",""
"1","1075","Absence Seizures","NAN","NAN","99","99","NAN","NAN","MIB1","Q86YT6","DisGeNET","NAN","NAN","NAN","0.3","1 PubMed IDs","NAN","NAN","CTD_human","UMLS:C4316903","NAN","Absence Seizures","Staring spells","Brief loss of awareness","Sudden stop in movement","Eye fluttering","Lip smacking","Chewing motions","Finger rubbing","Small movements of both hands","Head nodding","Absence seizures are a type of seizure that involves a brief, sudden lapse of consciousness. They are more common in children than adults. During an absence seizure, the person may stare blankly, stop talking, and may not respond to questions. The seizure usually lasts for only a few seconds, and the person typically recovers quickly without any confusion or aftereffects.","The symptoms of absence seizures can be subtle and easily missed. They may include staring spells, brief loss of awareness, sudden stop in movement, eye fluttering, lip smacking, chewing motions, finger rubbing, small movements of both hands, and head nodding.","The exact cause of absence seizures is not fully understood, but they are thought to be related to abnormal electrical activity in the brain. Genetic factors may also play a role.","Genetic predisposition","Brain injury","Stroke","Brain tumors","Infections","Antiepileptic medications","Vagus nerve stimulation","Ketogenic diet","NAN","NAN","NAN","Avoiding triggers such as stress, lack of sleep, and flashing lights","Maintaining a healthy lifestyle","Regular medical checkups","Family history of seizures","Young age","Neurological disorders","NAN","Childhood or adolescence","Genetic mutations affecting brain function","Family history of epilepsy or seizures","Mild to moderate, usually not life-threatening","Electroencephalogram (EEG)","Injuries from falls","Status epilepticus","Relatively common, affecting approximately 1 in 2,000 people","Generally good with proper treatment"
"1","1076","Absence Seizures","A type of generalized seizure characterized by a sudden, brief loss of consciousness without falling or convulsive movements. The person may appear to stare blankly into space for a few seconds.","PIGM is involved in the first step of glycosylphosphatidylinositol (GPI) anchor biosynthesis. GPI anchors attach proteins to the cell surface.","99","99","MONDO:0005059","False","PIGM","Q9H3S5","DisGeNET","4.5","0.8","0.5","0.3","PubMed IDs:28835413@ 26966080@ 25488987@ 22258587@ 20301428","Valproic acid@ Ethosuximide@ Lamotrigine","0.0001","CTD_human","UMLS:C4316903","MONARCH:S2O:0000077","Absence Seizures","Staring spells","Sudden brief loss of awareness","Eye blinking","Lip smacking","Chewing movements","Slight head nodding","Minor body jerks","No confusion after seizure","Seizures lasting a few seconds","Absence seizures are a type of seizure characterized by a brief loss of consciousness@ typically lasting only a few seconds. During an absence seizure@ the person may appear to stare blankly into space and may not respond to their surroundings.","Symptoms include staring@ fluttering eyelids@ and brief unresponsiveness.","Genetic factors and brain abnormalities can cause absence seizures.","Genetic mutations","Brain injuries","Infections","Metabolic disorders","Unknown causes","Ethosuximide","Valproic acid","Lamotrigine","Adequate sleep","Stress management","Avoiding triggers","NAN","Childhood or adolescence","Genetic mutations in genes like GABRG2@ CLCN2@ and CACNA1H","Family history of seizures or epilepsy","Mild to moderate; usually not life-threatening","Electroencephalogram (EEG)","Learning difficulties@ developmental delays@ accidents during seizures","Relatively common@ especially in children","Generally good with treatment; seizures can often be controlled with medication"
"1","1077","Absence Seizures","NAN","NAN","99","99","NAN","NAN","HCN1","O60741","DisGeNET","NAN","NAN","NAN","0.3","1 PubMed IDs","NAN","NAN","CTD_human","UMLS:C4316903","NAN","Absence Seizures","Staring spells","Sudden stops in activity","Lip smacking","Eye blinking","Chewing motions","Fumbling with hands","Unresponsiveness","Brief loss of awareness","NAN","Brief@ sudden lapses in consciousness or awareness. Characterized by staring spells@ often with associated subtle motor symptoms.","NAN","NAN","NAN","NAN","NAN","NAN","Antiepileptic drugs","Ethosuximide","Valproic acid","Avoiding triggers such as sleep deprivation and stress","Maintaining a regular sleep schedule","Ensuring adequate hydration","NAN","Childhood or adolescence","Genetic mutations affecting brain function","Family history of seizures or epilepsy","Generally mild@ but can affect learning and daily activities","EEG (electroencephalogram)","Injury from falls@ academic difficulties","Estimated prevalence of 1-10% in school-aged children","Generally good with appropriate treatment"
"1078","138","Absent reflex","NAN","NAN","5","5","NAN","NAN","ABAT","P80404","DisGeNET","NAN","NAN","NAN","0.3","1 PubMed IDs","NAN","NAN","CTD_human","UMLS:C0234146","NAN","Absent reflex","Diminished or absent reflexes in response to stimuli","Reduced or absent reflexes may indicate neurological dysfunction or nerve damage","Absent or reduced reflexes can result from various underlying conditions@ including neurological disorders@ nerve damage@ or certain medications.","NAN","NAN","NAN","NAN","Physical therapy","Medications to manage pain or underlying conditions","Assistive devices to improve mobility and function","Regular exercise to maintain muscle strength and flexibility","Avoiding activities that exacerbate nerve damage","Maintaining a healthy lifestyle to support overall health","Underlying medical conditions such as diabetes or autoimmune disorders","Any age","Genetic mutations or predispositions","Family history of neurological disorders or nerve damage","Severity varies depending on the underlying cause and the extent of nerve damage.","Neurological examination to assess reflexes","Muscle weakness@ numbness@ or difficulty with coordination","Variable; depends on the underlying cause and the effectiveness of treatment.","Prognosis varies depending on the underlying cause and the individual's response to treatment."
"1","1079","Absent reflex","NAN","NAN","5","5","NAN","NAN","CHRNB2","P17787","DisGeNET","NAN","NAN","NAN","0.3","1 PubMed IDs","NAN","NAN","CTD_human","UMLS:C0234146","NAN","Absent reflex","NAN","NAN","NAN","NAN","NAN","NAN","NAN","NAN","NAN","Absent reflex is a condition characterized by the absence of normal reflexes.","The absence of reflexes can indicate neurological damage or dysfunction.","The exact causes of absent reflexes vary depending on the underlying condition.","NAN","NAN","NAN","NAN","NAN","Treatment focuses on addressing the underlying cause of the absent reflexes.","Physical therapy and rehabilitation may be helpful in some cases.","Supportive care to manage symptoms.","Maintaining a healthy lifestyle may help prevent some conditions that can lead to absent reflexes.","Regular medical check-ups can help detect and manage potential underlying causes.","Avoiding injuries that can damage the nervous system.","Neurological disorders, infections, and injuries to the nervous system.","Can occur at any age, depending on the underlying cause.","Genetic factors may play a role in some neurological disorders associated with absent reflexes.","Family history of neurological disorders may increase the risk.","Severity varies depending on the underlying condition, ranging from mild to severe.","Neurological examination, including reflex testing.","Depends on the underlying condition, ranging from mild to severe.","Rare; incidence varies depending on the underlying condition.","Prognosis depends on the underlying cause and the effectiveness of treatment."
"1","1080","Absent reflex","NAN","NAN","5","5","NAN","NAN","PMP22","Q01453","DisGeNET","NAN","NAN","NAN","0.4","1 PubMed IDs","NAN","NAN","CTD_human","UMLS:C0234146","NAN","Hyporeflexia","Reduced reflexes","Muscle weakness","Fatigue","Numbness","Balance problems","Difficulty swallowing","Speech difficulties","Vision problems","Cognitive impairment","Hyporeflexia is a neurological sign characterized by diminished or absent reflexes. It can be caused by various underlying conditions affecting the nervous system.","Hyporeflexia often presents with reduced reflexes@ muscle weakness@ and fatigue. Other symptoms may include numbness@ balance problems@ difficulty swallowing@ speech difficulties@ vision problems@ and cognitive impairment.","Hyporeflexia can be caused by a variety of factors@ including nerve damage@ muscle disorders@ and metabolic conditions.","Peripheral neuropathy","Spinal cord injury","Muscular dystrophy","Guillain-Barré syndrome","Hypothyroidism","Physical trauma or injury","Infections","Autoimmune disorders","Physical therapy","Occupational therapy","Medications to manage underlying conditions","Regular exercise","Healthy diet","Avoiding toxins and risk factors","Risk factors for hyporeflexia include underlying medical conditions such as diabetes@ autoimmune disorders@ and neurological disorders.","Any age","Genetic factors may contribute to hyporeflexia in some cases@ particularly in inherited neurological disorders.","Family history of neurological disorders may increase the risk of hyporeflexia.","The severity of hyporeflexia can vary depending on the underlying cause and the extent of nerve or muscle damage.","Diagnosis of hyporeflexia typically involves a neurological examination to assess reflexes@ muscle strength@ and sensation.","Complications of hyporeflexia may include muscle weakness@ difficulty with movement@ and impaired coordination.","The epidemiology of hyporeflexia varies depending on the underlying cause. Some conditions that can cause hyporeflexia are more common in certain populations.","The prognosis for hyporeflexia depends on the underlying cause and the individual's response to treatment. With appropriate management@ many individuals with hyporeflexia can improve their function and quality of life."
"1","1081","Absent reflex","NAN","NAN","5","5","NAN","NAN","ATXN7","O15265","DisGeNET","NAN","NAN","NAN","0.3","1 PubMed IDs","NAN","NAN","CTD_human","UMLS:C0234146","NAN","Absent reflex","Diminished reflexes","Slowed movements","Muscle weakness","Unsteady gait","Difficulty with coordination","Speech problems","Swallowing difficulties","Vision problems","Numbness or tingling","Absent reflex refers to the lack of normal reflexes@ which are involuntary muscle movements in response to stimuli.","The absence of reflexes can indicate damage or dysfunction in the nervous system@ particularly in the brain@ spinal cord@ or peripheral nerves.","The causes of absent reflexes vary depending on the underlying condition affecting the nervous system.","Nerve damage","Spinal cord injury","Brain injury","Neuromuscular disorders","Metabolic disorders","Physical therapy","Occupational therapy","Medications to manage underlying conditions","Regular exercise","Healthy diet","Avoiding toxins","NAN","All ages","Genetic mutations","Family history of neurological disorders","Variable@ depending on the underlying cause","Neurological examination","Electrodiagnostic tests","Muscle atrophy","Contractures","Loss of function","Variable@ depending on the underlying cause","Variable@ depending on the underlying cause"
"1","1082","Absent reflex","NAN","NAN","5","5","NAN","NAN","TTPA","P49638","DisGeNET","NAN","NAN","NAN","0.4","1 PubMed IDs","NAN","NAN","CTD_human","UMLS:C0234146","NAN","Reflex loss","NAN","NAN","NAN","NAN","NAN","NAN","NAN","NAN","NAN","Absent reflexes are a clinical sign indicating neurological dysfunction. The absence of reflexes can be caused by a variety of conditions affecting the nervous system@ including damage to the nerves involved in the reflex arc or disorders affecting the brain or spinal cord.","Absent reflexes may manifest as a diminished or absent response to stimuli that would normally elicit a reflex reaction. This can affect various reflexes@ such as the knee-jerk reflex or the gag reflex.","Absent reflexes can result from a range of factors@ including peripheral nerve damage@ spinal cord injuries@ or certain neuromuscular disorders.","Peripheral neuropathy","Spinal cord injury","Neuromuscular disorders","NAN","NAN","Physical therapy","Occupational therapy","Medications to manage underlying conditions","NAN","NAN","NAN","Conditions affecting nerve function@ spinal cord@ or brain","All ages","Genetic disorders affecting nerve or muscle function","Family history of neurological disorders","Varies depending on the underlying cause@ ranging from mild to severe","Neurological examination to assess reflexes","Difficulty with movement@ impaired coordination@ muscle weakness","Varies depending on the underlying cause","Varies depending on the underlying cause"
"1","1083","absent tibia-polydactyly syndrome","NAN","NAN","1","1","MONDO:0020306","1.0","LMBR1","Q8WVP7","CTD","NAN","NAN","NAN","NAN","marker/mechanism","NAN","NAN","NAN","MESH:C535564","NAN","absent tibia-polydactyly syndrome","NAN","NAN","NAN","NAN","NAN","NAN","NAN","NAN","NAN","Absent tibia-polydactyly syndrome is a rare genetic disorder characterized by the absence or underdevelopment of the tibia (shin bone) and the presence of extra fingers or toes (polydactyly).","This syndrome primarily affects the development of the limbs@ specifically the tibia and digits.","The exact cause is genetic@ likely involving mutations in genes responsible for limb development.","Genetic mutations","NAN","NAN","NAN","NAN","Surgery to correct limb deformities and remove extra digits","Physical therapy to improve mobility","Occupational therapy to aid in daily activities","Genetic counseling for families","Prenatal screening for at-risk pregnancies","NAN","Genetic mutations@ family history","Congenital","Genetic mutations in limb development genes","Family history of limb malformations","Severity varies depending on the extent of skeletal abnormalities","X-ray imaging@ physical examination","Limb length discrepancies@ difficulties with walking and mobility","Very rare@ limited epidemiological data","Variable@ depending on the severity and treatment outcomes"
"1","1084","absent tibia-polydactyly syndrome","NAN","NAN","1","1","MONDO:0020306","1.0","LMBR1","Q8WVP7","DisGeNET","NAN","NAN","NAN","0.4","2 SNPs","NAN","NAN","CTD_human","UMLS:C1861099","NAN","absent tibia-polydactyly syndrome","NAN","NAN","NAN","NAN","NAN","NAN","NAN","NAN","NAN","Absent tibia-polydactyly syndrome is a very rare genetic limb malformation syndrome characterized by unilateral or bilateral aplasia/hypoplasia of the tibia associated with preaxial polydactyly of the feet.","NAN","NAN","NAN","NAN","NAN","NAN","NAN","NAN","NAN","NAN","NAN","NAN","NAN","NAN","NAN","NAN","NAN","NAN","NAN","NAN","NAN","NAN","NAN"
"1","140","ACAMPOMELIC CAMPOMELIC DYSPLASIA WITH AUTOSOMAL SEX REVERSAL","NAN","NAN","1","1","NAN","NAN","SOX9","P48436","DisGeNET","NAN","NAN","NAN","0.3","12 PubMed IDs@ 6 SNPs","NAN","NAN","UNIPROT","UMLS:C3549544","NAN","Campomelic Dysplasia","Shortened or bowed limbs","Bowed bones","Clubfoot","Underdeveloped shoulder blades","Bell-shaped chest","Small chest","Abnormal rib cage","Deformed legs","NAN","Campomelic dysplasia is a rare skeletal disorder characterized by bowing of the long bones@ particularly the femurs (thigh bones) and tibias (shin bones).","The exact cause is often related to mutation in the SOX9 gene.","Mutations in the SOX9 gene","Genetic factors","De novo mutations","Autosomal dominant inheritance","NAN","NAN","NAN","NAN","NAN","NAN","NAN","Family history of skeletal disorders","NAN","Genetic mutations","Family history of skeletal disorders","Variable@ depends on the severity","Prenatal ultrasound@ genetic testing","Respiratory distress@ scoliosis@ neurological problems","Rare","Variable@ depends on the severity and complications"
