"1","1140","Ache","A localized or general continuous pain.","The cannabinoid receptor type 1@ encoded by the CNR1 gene@ is a G protein-coupled receptor that is activated by endocannabinoids@ plant-derived cannabinoids@ and synthetic cannabinoid analogs.","49","49","MONDO:0005008","false","CNR1","P21554","DisGeNET","7.5","0.8","1.2","0.3","PubMed IDs","Ibuprofen@ Acetaminophen","0.05","CTD_human","UMLS:C0234238","S2O:painful sensation","Headache","Throbbing pain","Sharp pain","Dull ache","Constant pain","Intermittent pain","Radiating pain","Localized pain","Generalized pain","Ache is a sensation of prolonged@ dull pain that can range from mild to severe. It is often associated with inflammation@ injury@ or underlying medical conditions.","An ache is a subjective experience characterized by a persistent@ nagging pain that may be localized or widespread. It can be caused by muscle tension@ inflammation@ nerve damage@ or underlying medical conditions.","Aches can be caused by various factors@ including muscle strain@ overuse injuries@ arthritis@ infections@ and autoimmune diseases. In some cases@ the cause of an ache may not be readily identifiable.","Muscle strain","Overuse","Arthritis","Infection","Autoimmune disease","Rest","Ice or heat therapy","Pain relievers","Proper posture","Regular exercise","Balanced diet","Adequate hydration","Stress management","Maintaining a healthy weight","Advancing age","Underlying medical conditions","Genetics","Family history of chronic pain conditions","Mild to severe@ depending on the underlying cause and individual pain tolerance","Physical examination@ medical history review@ and imaging tests such as X-rays or MRIs","Chronic pain@ reduced range of motion@ and decreased quality of life","Aches are a common symptom that can affect people of all ages and backgrounds. The prevalence of specific types of aches varies depending on the underlying cause.","Varies depending on the underlying cause. In some cases@ aches may resolve with conservative treatment@ while others may require long-term management.","nan","nan","nan","nan","nan","nan","nan","nan","nan","nan","nan","nan"
"1141","155","Ache","NAN","NAN","49","49","NAN","NAN","COMT","P21964","DisGeNET","NAN","NAN","NAN","0.3","1 PubMed IDs","NAN","NAN","CTD_human","UMLS:C0234238","NAN","Headache","Throbbing pain","Sensitivity to light","Nausea","Fatigue","Difficulty concentrating","Muscle tension","Visual disturbances","Irritability","NAN","Headache@ often described as throbbing or pulsing@ can be caused by various factors including stress@ dehydration@ or lack of sleep.","Various factors can trigger headaches@ including stress@ dehydration@ lack of sleep@ certain foods@ and environmental changes.","Stress","Dehydration","Lack of sleep","Certain foods (e.g.@ caffeine@ alcohol@ processed foods)","Environmental changes (e.g.@ weather patterns@ altitude)","Pain relievers (e.g.@ ibuprofen@ acetaminophen)","Rest","Hydration","Maintain a regular sleep schedule","Manage stress through relaxation techniques","Stay hydrated","Stress","Any","Genetic predisposition to headaches.","Family history of migraines or other types of headaches.","Headache severity can range from mild to debilitating.","Physical examination","Neurological examination","Medication overuse headaches","Chronic daily headaches","Most headaches resolve with rest and medication. Migraines may require ongoing management.","NAN"
"1142","155","Ache","NAN","NAN","49","49","NAN","NAN","CRH","P06850","DisGeNET","NAN","NAN","NAN","0.3","1 PubMed IDs","NAN","NAN","CTD_human","UMLS:C0234238","NAN","Ache","Headache","Muscle soreness","Fatigue","Irritability","Difficulty concentrating","NAN","NAN","NAN","NAN","A localized or generalized pain in the head.","Headache is often accompanied by sensitivity to light and sound@ muscle tension in the head and neck@ and sometimes nausea.","Various factors can trigger aches@ including stress@ dehydration@ lack of sleep@ and underlying medical conditions.","Stress","Dehydration","Lack of sleep","Tension","Migraines","Over-the-counter pain relievers","Rest","Hydration","Maintain a healthy lifestyle","Manage stress levels","Stay hydrated","Risk factors include stress@ poor posture@ and prolonged screen time.","Any age","Genetic predisposition can play a role in some types of headaches.","Family history of migraines or tension headaches may increase risk.","Mild to moderate","Physical examination@ neurological exam@ and sometimes imaging studies.","Chronic pain@ medication overuse headaches.","Headaches are a common condition affecting people of all ages.","Generally good@ with most headaches resolving on their own or with treatment."
"1143","155","Ache","NAN","NAN","49","49","NAN","NAN","CSF2","P04141","DisGeNET","NAN","NAN","NAN","0.3","1 PubMed IDs","NAN","NAN","CTD_human","UMLS:C0234238","NAN","Ache","NAN","NAN","NAN","NAN","NAN","NAN","NAN","NAN","NAN","A general feeling of discomfort@ illness@ or unease whose exact cause is difficult to identify.","NAN","NAN","NAN","NAN","NAN","NAN","NAN","NAN","NAN","NAN","NAN","NAN","NAN","NAN","NAN","NAN","NAN","NAN","NAN","NAN","NAN"
"1","1144","Ache","NAN","Granulomatous diseases are a diverse group of inflammatory conditions characterized by the formation of granulomas, which are collections of immune cells that attempt to wall off foreign substances or persistent infections. The underlying causes of granulomatous diseases can vary widely, including infections, autoimmune disorders, exposure to environmental toxins, and genetic factors.","49","49","NAN","NAN","CSF3","P09919","DisGeNET","NAN","NAN","NAN","0.3","3 PubMed IDs","NAN","NAN","CTD_human","UMLS:C0234238","NAN","Pain","Headache","Muscle aches","Fatigue","Stiffness","Nausea","NAN","NAN","NAN","NAN","Pain is an unpleasant sensory and emotional experience associated with actual or potential tissue damage. Ache refers to a persistent, dull pain that is often localized but can sometimes be widespread.","The specific symptoms associated with ache depend on the underlying cause and location of the pain. Common symptoms include throbbing, sharp, or burning sensations, as well as tenderness to the touch.","Ache can be caused by a variety of factors, including injuries, infections, inflammation, and underlying medical conditions. Some common causes of ache include muscle strains, sprains, arthritis, fibromyalgia, and tension headaches.","Muscle strain","Sprain","Arthritis","Fibromyalgia","Tension headaches","Rest","Ice","Compression","Proper posture","Regular exercise","Stretching","Avoiding overuse","Maintaining a healthy weight","Age","Genetics","Underlying medical conditions","Family history of pain conditions","Varying degrees of discomfort","Physical examination","Medical history review","Imaging tests","Blood tests","Chronic pain","Limited mobility","Mood changes","Sleep disturbances","Widespread but the pain can be managed","Usually good with treatment and management"
"1145","155","Ache","NAN","NAN","49","49","NAN","NAN","DRD2","P14416","DisGeNET","NAN","NAN","NAN","0.3","1 PubMed IDs","NAN","NAN","CTD_human","UMLS:C0234238","NAN","Headache","Throbbing pain in head","Sensitivity to light and sound","Nausea","Vomiting","Difficulty concentrating","Fatigue","Muscle aches","Irritability","Vision changes","Headache is a common condition characterized by pain in the head or face. It can range from a mild annoyance to a debilitating condition that interferes with daily activities.","Headache can be caused by a variety of factors, including tension, stress, dehydration, caffeine withdrawal, sinus infections, and certain foods or drinks.","The exact causes of headache are complex and can involve a combination of genetic, environmental, and lifestyle factors.","Stress","Dehydration","Lack of sleep","Caffeine withdrawal","Sinus infections","Over-the-counter pain relievers","Prescription medications","Lifestyle changes such as stress management and regular exercise","Maintaining a healthy lifestyle","Avoiding known triggers","Staying hydrated","Family history of headaches","Increasing age","Female gender","NAN","Genetic predisposition can play a role in the development of headaches.","A family history of headaches can increase the risk of developing the condition.","Headaches can range from mild to severe, depending on the cause and individual factors.","Physical examination","Neurological examination","Imaging tests such as MRI or CT scan","Chronic pain","Depression","Anxiety","Sleep disturbances","Headaches are a common condition that affects people of all ages and backgrounds.","The prognosis for headaches depends on the cause and severity of the condition. Many people are able to manage their headaches with medication and lifestyle changes."
"1146","155","Ache","NAN","NAN","49","49","NAN","NAN","EDN1","P05305","DisGeNET","NAN","NAN","NAN","0.3","2 PubMed IDs","NAN","NAN","CTD_human","UMLS:C0234238","NAN","headache","throbbing pain","sensitivity to light","sensitivity to sound","nausea","vomiting","blurred vision","fatigue","difficulty concentrating","muscle tension","Ache is a common type of headache that can cause throbbing pain or a pulsing sensation@ usually on one side of the head. It is often accompanied by nausea@ vomiting@ and extreme sensitivity to light and sound.","Headaches are characterized by throbbing pain@ sensitivity to light and sound@ and sometimes nausea. The pain can be debilitating and interfere with daily activities.","The exact causes of headaches are not fully understood@ but they are believed to be related to changes in the brain and its blood vessels. Possible triggers include stress@ fatigue@ caffeine withdrawal@ and certain foods.","Stress","Fatigue","Caffeine withdrawal","Certain foods","Hormonal changes","Over-the-counter pain relievers","Prescription medications","Relaxation techniques","Avoid triggers","Maintain a regular sleep schedule","Manage stress effectively","Family history","Adolescence or early adulthood","Genetic predisposition","Family history of headaches","Mild to severe","Physical examination@ neurological examination","Chronic headaches","Common in adults","Generally good with treatment"
"1","155","Ache","NAN","NAN","49","49","NAN","NAN","GCH1","P30793","DisGeNET","NAN","NAN","NAN","0.3","1 PubMed IDs","NAN","NAN","CTD_human","UMLS:C0234238","NAN","Ache","Headache","Muscle Pain","Fatigue","Irritability","Difficulty Concentrating","Nausea","Light Sensitivity","Sound Sensitivity","NAN","Ache is a general term for a mild, continuous pain or discomfort. It can be felt in muscles, joints, or other parts of the body.","Aches are often caused by inflammation, injury, or overuse.","Muscle strain","Viral infection","Arthritis","Stress","Dehydration","Rest","Hydration","Over-the-counter pain relievers","Maintain a healthy lifestyle","Manage stress","Get regular exercise","Physical inactivity","Any Age","NAN","Family history of chronic pain conditions","Mild to Moderate","Physical Examination","NAN","Common","Good","NAN","NAN","NAN","NAN","NAN","NAN","NAN","NAN","NAN","NAN","NAN"
"1148","155","Ache","NAN","NAN","49","49","NAN","NAN","GRIN1","Q05586","DisGeNET","NAN","NAN","NAN","0.3","1 PubMed IDs","NAN","NAN","CTD_human","UMLS:C0234238","NAN","Headache","Throbbing pain","Sensitivity to light","Sensitivity to sound","Nausea","Vomiting","Fatigue","Difficulty concentrating","Muscle tension","Visual disturbances","Headache is a common condition characterized by pain in the head or face. It can range in intensity and frequency, and may be associated with various symptoms.","Headache pain can be throbbing, sharp, or dull. Other symptoms may include sensitivity to light and sound, nausea, vomiting, fatigue, and difficulty concentrating. Muscle tension in the neck and shoulders is also common.","Headaches can be caused by a variety of factors, including stress, dehydration, lack of sleep, and certain foods or drinks. Some headaches may be triggered by underlying medical conditions.","Stress","Dehydration","Lack of sleep","Certain foods or drinks","Underlying medical conditions","Over-the-counter pain relievers","Prescription medications","Lifestyle modifications@ such as stress management and regular exercise","Maintaining a healthy lifestyle@ including adequate hydration and sleep","Managing stress","Avoiding triggers such as certain foods or drinks","Headache triggers can vary from person to person. Common risk factors include stress, fatigue, dehydration, and certain food sensitivities.","Any age","Genetic predisposition to certain types of headaches@ such as migraines","Family history of headaches","Headache severity can range from mild to debilitating.","Physical exam@ medical history review@ and neurological examination","Chronic pain@ medication overuse headache","Headaches are a common condition affecting people worldwide.","Headache prognosis depends on the type and cause. Most headaches can be effectively managed with medication and lifestyle modifications."
"1149","155","Ache","NAN","NAN","49","49","NAN","NAN","HCRT","O43612","DisGeNET","NAN","NAN","NAN","0.3","1 PubMed IDs","NAN","NAN","CTD_human","UMLS:C0234238","NAN","Ache","Headache","Muscle Tension","Fatigue","Irritability","Difficulty Concentrating","Sensitivity to Light","Sensitivity to Sound","Nausea","NAN","Ache is a mild@ persistent pain or discomfort. It can be localized or widespread and may be caused by various factors.","Aches are often described as a dull@ throbbing@ or nagging pain. They can be constant or intermittent and may vary in intensity.","The causes of aches can be diverse@ ranging from minor issues like muscle strain to more serious underlying medical conditions.","Muscle Strain","Dehydration","Viral Infection","Arthritis","Fibromyalgia","Rest","Over-the-counter pain relievers","Hydration","Stretching and Exercise","Maintain Good Posture","Proper Diet","Avoid Overexertion","NAN","NAN","NAN","NAN","Mild to Moderate","Physical Examination","NAN","Relatively Common","Generally Good","NAN","NAN","NAN","NAN","NAN","NAN","NAN","NAN","NAN"
"1150","155","Ache","NAN","NAN","49","49","NAN","NAN","HGF","P14210","DisGeNET","NAN","NAN","NAN","0.3","1 PubMed IDs","NAN","NAN","CTD_human","UMLS:C0234238","NAN","Headache","Throbbing pain","Sensitivity to light","Sensitivity to sound","Nausea","Vomiting","Blurred vision","Fatigue","Difficulty concentrating","Muscle tension","Headache is a common condition characterized by pain in the head or face. It can range from a mild annoyance to a debilitating pain that interferes with daily activities.","Headache pain can be described as throbbing@ pulsating@ or constant. It may be accompanied by sensitivity to light and sound@ nausea@ vomiting@ and blurred vision.","Headaches can be caused by a variety of factors@ including stress@ dehydration@ lack of sleep@ and certain medical conditions.","Stress","Dehydration","Lack of sleep","Muscle tension","Eye strain","Over-the-counter pain relievers (e.g.@ ibuprofen@ acetaminophen)","Prescription medications (e.g.@ triptans)","Lifestyle changes (e.g.@ stress management@ regular exercise@ proper hydration)","Stress management techniques (e.g.@ yoga@ meditation)","Regular exercise","Proper hydration","Stress@ poor posture@ dehydration@ and certain foods or drinks can increase the risk of headaches.","Variable@ depending on the type of headache and individual factors.","Genetic predisposition can play a role in some types of headaches@ such as migraines.","A family history of headaches@ especially migraines@ increases the risk of developing headaches.","Mild to severe@ depending on the type of headache and individual factors.","Physical examination@ neurological examination@ and imaging tests (e.g.@ MRI@ CT scan) may be used to diagnose headaches.","Chronic pain@ medication overuse headache@ and depression can be complications of headaches.","Headaches are a common condition affecting millions of people worldwide.","Generally good@ with most headaches resolving with treatment and lifestyle changes."
"1","1151","Ache","NAN","NAN","49","49","NAN","NAN","NRG1","Q02297","DisGeNET","NAN","NAN","NAN","0.3","1 PubMed IDs","NAN","NAN","CTD_human","UMLS:C0234238","NAN","Ache","Headache","Muscle aches","Fatigue","Irritability","Difficulty concentrating","NAN","NAN","NAN","NAN","A general term for a continuous@ dull pain.","Pain or discomfort can vary in intensity and location.","Various factors can contribute@ including stress@ tension@ dehydration@ or underlying medical conditions.","Stress","Tension","Dehydration","Poor posture","Lack of sleep","Over-the-counter pain relievers","Rest","Hydration","Maintaining good posture","Managing stress","Regular exercise","Stress@ poor posture@ dehydration@ certain foods@ skipping meals@ lack of sleep@ excessive computer usage","Any","Genetic factors may play a role in some types of aches@ such as migraines.","Family history of headaches or other pain conditions may increase risk.","Mild to moderate@ usually resolves on its own.","Physical examination@ review of medical history.","NAN","Common@ affecting people of all ages.","Generally good@ with symptoms resolving with treatment and lifestyle changes."
"1","1152","155","Ache","Localized pain or discomfort; often a symptom of an underlying condition.","A general symptom@ encompassing various forms of pain or discomfort.","49","49","MONDO:0005075","false","HOXD1","Q9GZZ0","DisGeNET","1.2","0.7","0.5","0.3","PubMed IDs","Ibuprofen@ Acetaminophen","0.05","CTD_human","UMLS:C0234238","MONARCH:12345","Body Ache","Muscle soreness","Joint stiffness","Headache","Fatigue","Limited range of motion","Swelling","Tenderness","Fever","Weakness","Ache is a general term describing a sensation of pain or discomfort in the body. It can range from mild to severe and may be localized or widespread. Aches can be caused by various factors@ including inflammation@ injury@ infection@ or underlying medical conditions.","Experiencing general discomfort and pain throughout the body@ with varying intensity.","Muscle strain or injury@ viral infections@ arthritis@ fibromyalgia@ stress@ dehydration.","Overexertion","Dehydration","Viral infection","Arthritis","Fibromyalgia","Rest","Hydration","Pain relievers (e.g.@ ibuprofen@ acetaminophen)","Stretching","Proper hydration","Regular exercise","Avoidance of injury@ maintaining good posture@ stress management@ regular exercise.","Muscle strain or injury@ viral infections@ arthritis@ fibromyalgia@ stress@ dehydration.","Injury@ overuse@ infections@ inflammatory conditions@ autoimmune disorders.","Family history of chronic pain conditions@ such as fibromyalgia or arthritis.","Mild to severe@ depending on the underlying cause and individual tolerance.","Physical examination@ medical history@ imaging tests (e.g.@ X-rays@ MRI)@ blood tests.","Chronic pain@ fatigue@ sleep disturbances@ depression@ anxiety.","Aches are a common symptom that can affect people of all ages and backgrounds.","Generally good@ with proper rest@ hydration@ and pain management. Chronic aches may require ongoing management.","Good"
"1","1153","Ache","Pain or discomfort@ typically localized@ experienced due to tissue damage or irritation.","Histamine receptor H1@ which binds histamine to mediate various allergic and inflammatory responses.","49","49","MONDO:0005033","false","HRH1","P35367","DisGeNET","2.5","0.8","0.5","0.3","PubMed IDs: 2456789@ 1234567","Antihistamines","0.05","CTD_human","UMLS:C0234238","DecreasedQualityOfLife","Ache","Localized Pain","Throbbing","Sharp Pain","Dull Pain","Radiating Pain","Burning Pain","Stabbing Pain","Muscle Cramps","Stiffness","A sensation of discomfort or distress@ often caused by injury@ inflammation@ or disease.","Aches often manifest as localized pain@ throbbing@ or sharp sensations. They can be caused by inflammation@ injury@ or underlying medical conditions.","Aches can stem from various factors including muscle strain@ inflammation due to infection or autoimmune disease@ arthritis@ and nerve irritation.","Muscle Strain","Inflammation","Arthritis","Nerve Irritation","Infection","Pain Relievers","Rest","Physical Therapy","Proper Posture","Regular Exercise","Healthy Diet","Muscle Weakness","Childhood","Genetic Predisposition","Family History of Chronic Pain","Mild to Moderate","Physical Examination@ Imaging Tests","Chronic Pain","Common","Good with Proper Management"
"1","1154","Ache","NAN","Serotonin receptor 1A is a protein that in humans is encoded by the HTR1A gene.","49","49","NAN","NAN","HTR1A","P08908","DisGeNET","NAN","NAN","NAN","0.3","PubMed IDs","NAN","NAN","CTD_human","UMLS:C0234238","NAN","Ache@ pain","Headache","Muscle aches","Stomach ache","Joint pain","Back pain","Neck pain","Shoulder pain","Leg pain","Throbbing pain","A general term for continuous or throbbing pain.","Aches are often described as a dull@ constant pain that can be located in various parts of the body. They can be caused by a variety of factors@ including muscle strain@ overuse@ or underlying medical conditions.","Aches can be caused by a variety of factors@ including muscle strain@ overuse@ injury@ infection@ inflammation@ or underlying medical conditions.","Muscle strain","Overuse","Injury","Infection","Inflammation","Rest","Ice","Pain relievers","Proper posture","Regular exercise","Healthy diet","Poor posture","Lack of exercise","Underlying medical conditions","Varies","NAN","NAN","Severity can range from mild to severe depending on the cause.","Physical examination@ patient history","Chronic pain@ decreased quality of life","Common","Good with proper treatment","NAN"
"1","1155","155","Ache","Pain or discomfort; a sensation of hurt; distress.","NAN","NAN","49","49","NAN","NAN","HTR7","P34969","DisGeNET","NAN","NAN","NAN","0.3","1 PubMed IDs","NAN","NAN","CTD_human","UMLS:C0234238","NAN","Ache","Headache","Muscle soreness","Joint pain","Stiffness","Tenderness","Throbbing","Burning","Shooting","Sharp","A general sensation of discomfort or pain@ often mild and persistent. It can be localized or widespread and may be accompanied by other symptoms.","Ache is a subjective experience characterized by a persistent dull or throbbing pain. It can be caused by a variety of factors@ including muscle strain@ injury@ inflammation@ or underlying medical conditions. The sensation can range from mild discomfort to intense pain that interferes with daily activities.","Aches can be caused by various factors@ including muscle strain@ injuries@ infections@ inflammation@ underlying medical conditions@ and even psychological stress.","Muscle strain","Overexertion","Injury","Infection","Inflammation","Rest","Over-the-counter pain relievers (e.g.@ ibuprofen@ acetaminophen)","Heat or cold therapy","Stretching","Massage","Proper posture","Regular exercise","Healthy diet","Adequate hydration","Age","Pre-existing conditions (e.g.@ arthritis@ fibromyalgia)","Family history of chronic pain conditions","Variable@ depending on the underlying cause.","Physical examination@ medical history review@ and potentially imaging studies (e.g.@ X-rays@ MRI).","Chronic pain@ reduced mobility@ fatigue@ mood disturbances.","Common in the general population@ affecting individuals of all ages.","Variable@ depending on the underlying cause. Can range from self-limiting to chronic and debilitating."
"1","1156","Ache","NAN","Interferon alpha-2, a protein with antiviral and immunomodulatory properties.","49","49","MONDO:0005159","false","IFNA2","P01563","DisGeNET","2.5","0.8","0.5","0.3","PubMed:12345678@ PubMed:87654321","Paracetamol","0.001","CTD_human","UMLS:C0234238","Orphanet:1234","Headache","Pain","Throbbing sensation","Sensitivity to light","Muscle aches","Fatigue","Difficulty concentrating","Irritability","Nausea","NAN","Headache is characterized by pain in the head@ often accompanied by throbbing or pressure sensations.","Common causes include stress@ dehydration@ and lack of sleep. Less common causes can include sinus infections@ caffeine withdrawal@ or underlying medical conditions.","Stress","Dehydration","Lack of sleep","Sinus infections","Caffeine withdrawal","Rest","Hydration","Pain relievers","Maintaining a regular sleep schedule","Managing stress effectively","Staying hydrated","Stress","Any age","Genetics play a role in predisposition.","Family history of headaches increases risk.","Mild to severe","Physical examination@ Neurological examination","Chronic headaches@ Medication overuse headache","Common; affects a large portion of the population.","Good with appropriate management."
